	0
0	Bokep Sex Desi Desire
1	Bokep Indo Freaky Ben loves panthose and girls with fake c…
2	Bokep Chanel preston takes a full load of cum from he…
3	Gratis Bokep Streaming Air squat nude workout nude ass close up to cam
4	Bokep Japanese Dual Wands
5	Bokep Korean Xo Gisele hot masturbation
6	Bokep Porno Gorgeous Young Camgirl Pleasures Her Smooth Ama…
7	Nonton Video Bokep Owned pussycat
8	Gratis Bokep Asian MILF Vicki Chase Gets Double Penetrated
9	Bokep Indo Sexy Short Haired Girl on Hidden Camera
10	Bokep Korean Face Fucking My Ex Sexy On Webcam – amateursexy…
11	Bokep Indo Jovencita bailando y perreando desnuda de visit…
12	Gratis Bokep Streaming Blonde daughter rides monster black cock
13	Video Bokep Japanese Beautiful serf gals tormented and broken
14	Bokep Porno sexydea pov anal trailer
15	Bokep Japanese VID 20130206 222630
16	Nonton Video Bokep Streaming Digital Playground – Upcoming Movies On March (…
17	Bokep Indo found cheating milf at HOOKSEX.COM and we had n…
18	Bokep Jepang Blonde and brunette fucking at party
19	Nonton Video Bokep Streaming Pegas Productions – Mam Steel Nail 2 Horny Teen
20	Bokep CutiesGalore Presents Mariah
21	Nonton Video Bokep Hot milf mother helping creepy brother fuck his…
22	Bokep Streaming Classy callgirl pussylicked and doggystyled
23	Bokep Online Collared and owned by Jasmeen LeFleur
24	Bokep Korean One Of The Best Australian Boobs
25	Download Bokep Streaming POV Big White Dick Interracial Blowjob Cumshot
26	Download Video Bokep find6.xyz Hot chloe norgaard playing on live we…
27	Bokep Porno Young amateur gets cock to shag her cum-hole bi…
28	Bokep Sex Horny guy gets banged with strap on
29	Bokep Jepang MILF Nikki Nevada Masturbates
30	Bokep Sex Female Fake Taxi Cheeky passenger loves drivers…
31	Bokep Japanese Girl teases a lustful stag and gets his huge th…
32	Bokep Indo Public CREAMPIE // ANAL Fuck and BJ in Park
33	Bokep 3gp Mckayla poolsex
34	Download Bokep Streaming Ass and Tits April 1, 2018 k
35	Bokep Sucking Big www.DiamondStaxx.EscortFiles.com
36	Bokep Sex Fellas are all over her wet pussy and she is ge…
37	Nonton Video Bokep Streaming TEENGONZO Two petite teen girls licking and fin…
38	Bokep 3gp Brandi Coxxx
39	Nonton Video Bokep Wife Fucks 2 Big Dick while hubby’s at work – P…
40	Bokep Streaming Lesbian babes enjoy some cock each one time in …
41	Bokep Streaming Horny Amateur Milf Housewife Orgasms With Dildo…
42	Bokep Streaming Mommy Son Playtime
43	Gudang Video Bokep Geiles Amateur Emo Girl geniesst geilen Fick im…
44	Bokep Korean Elsa Jean’s home video masturbation
45	Bokep Porno The Casting with this Handsome Newbie goes Wrong
46	Bokep Sex Blowjob in backseat of boyfriend’s car
47	Bokep Jepang Aruba Jasmine fucks herself
48	Bokep Jepang 2
49	Bokep Streaming babe alexxxcoal Fucking on live webcam– find6…
50	Bokep Sucking Big 41Ticket – Is This Your First Time? (Uncensored…
51	Bokep Indo Locker-room Sex
52	Bokep Streaming 3 sluts in outdoor orgy next to the road before…
53	Video Bokep Hot Amateur webcams big tits masturbation dildo – c…
54	Video Bokep Hot Tight blonde beauty taking a doggy style fuck i…
55	Bokep Online kitty licks
56	Bokep Sex Big booty ebony twerking for the camera
57	Bokep Sucking Big Stepbro and stepsis play on cam – Watch More Vi…
58	Bokep Sex FMD 0582 05
59	Bokep Jepang Black Cock Lover Julia Ann
60	Bokep Porno Black girl like a big black cock #1
61	Bokep Porno cute inctcunt fingering herself on live webcam …
62	Bokep Japanese Ebony hottie craving for white dick
63	Bokep Porno Chubby blonde Nataly Gold pussy stretching show…
64	Download Bokep with girl – full clip at https://shink.in/iKh50
65	Bokep Online No cheating in Marriage! HOW?!
66	Bokep Online Amazing Sex with a Big Titted Girl – pronnn.com
67	Download Video Bokep Havoc haily live
68	Nonton Video Bokep bandicam 2018-05-06 10-23-56-025
69	Bokep Online Brittney Nobles striptease and dildo play
70	Bokep Indo Laura OrsolyaEva NottyAngel WickyMaserati…
71	Bokep BLACK4K. Hot fucking after a business trip
72	Bokep 3gp Lilu Moon and Kira Roller fucked in the ass by …
73	Download Video Bokep Swing Party Orgasm Score-Ladies 3-Guys 0-Slut M…
74	Bokep Indo find6.xyz shy teen tight pussy part 2 dildo
75	Bokep Sex Big tit blonde loves some ebony thick cock into…
76	Bokep Streaming Liz Vicious Playing with my Pink and Black Dildo
77	Bokep Porno Huge Boobs On Webcam Gets Tit Fucked And Ends W…
78	Gratis Bokep Shy Japanese teen showing us her creamy body an…
79	Bokep Jepang Big Tit Wife gives amazing Blowjob and Doggy POV
80	Video Bokep Japanese Viotoxica Movie Mode
81	Gratis Bokep trim.7E9385E0-B5E9-486A-8BA7-16CEFD0CA433.MOV
82	Video Bokep Sex New Jersey Toe Pike (Part 1)
83	Bokep Korean Latex Dominatrix Eva Notty plays with her Busty…
84	Bokep Jepang bbw fun pt2
85	Bokep Indo My Mature Wife Shakes Her Fine AssFor Another…
86	Bokep Porno Busty gal gets face fucked
87	Bokep Sex xvideos.com 8171d12052a6057a77c2685cc0a3fb98-1
88	Bokep Online Stepsister gave a fresh handjob for her stepbro…
89	Bokep Sucking Big BBW Hot Creampie Cumshot
90	Bokep Porno Steamy Lesbian Seance
91	Bokep 3gp Fucking Petite Brunette Alexis Comes to Reality
92	Bokep Indo Dirty small titted lesbians lick and finger anuses
93	Bokep Indo GirlfriendsFilms Anya Olsen Teases MILF into Sc…
94	Bokep Japanese Stunning granny and young guy
95	Bokep Japanese Sensual lesbians Liza Kolt and Charlotte Shay i…
96	Bokep Korean Busty Japanese Mama Shower –Pink Pant
97	Gratis Bokep roshana pussy@camshow
98	Bokep Indo cougar pussy milf white squirting
99	Bokep Streaming Savana Styles Panty Play
100	Video Bokep Wife Whoremanda
101	Bokep Japanese WebCam Sexy 1976 – Hottiegia
102	Bokep 3gp It’s OK to Jerk Off
103	Bokep Indo huge natural teen Jana fox solo masturbation in…
104	Bokep Porno Very cute girl fisted ass Hard Asshole gape and…
105	Bokep Korean Video 20170730061447430 by videoshow
106	Bokep 3gp kristina c gets tagged teamed
107	Bokep Korean B. Jonelle Slideshow
108	Bokep Behind the scene in a monastic cell
109	Bokep Korean Office lady taught a brutal anal lesson
110	Download Video Bokep chassitybandz riding a mean dick !!
111	Bokep Sex Faraway So Close – Cayla Lions, Silvie Luca
112	Video Bokep El mejor culo del mundo – The best ass in the w…
113	Bokep Sex Dana DeArmond and Wolf Hudson Fuck
114	Bokep Fresh Teen Victoria Ferrera Introduced to Hardc…
115	Bokep Porno grandma is a cum loving whore preview
116	Video Bokep Hot Mallcuties Amateur Girls compilation have sex o…
117	Download Bokep Tusuk dari belakang
118	Bokep 3gp FUCKED REALLY HARD!!!
119	Gratis Bokep Daniella blanco getting fucked almosta threesome
120	Download Bokep I have fuck my wife, she say fucking cuckold an…
121	Bokep 3gp Jennica Lynn gets CREAMPIED
122	Gratis Bokep trim.2AE30B3E-F474-4D50-9F6C-8EDFF19C6BEC.MOV
123	Download Video Bokep Angel Del Rey gets her bouny ass pounded
124	Gudang Video Bokep Mi mascarilla / My milk mask
125	Bokep Indo Espiada
126	Bokep Porno siri sixxxfather in law sub spanish
127	Bokep Indo fat babe gives me blowjob
128	Gratis Bokep MissaX.com – Watching Porn with Nadya – Preview…
129	Download Video Bokep Cellar and gothic chamber.
130	Bokep Streaming 9
131	Video Bokep Sex Teen with big ass rides my big juicy cock
132	Nonton Video Bokep Sunny Lane Services Big Cock in Hotel Room
133	Gratis Bokep Streaming Big Tits psychologist Angel Wicky prescribes ha…
134	Gratis Bokep Streaming I tried pee , glassdeskproductions.com
135	Bokep Japanese insanely hot teen with massive boobs
136	Video Bokep Petite Mexican Teen Gets A Rough Anal Pounding
137	Bokep Streaming Blonde’s tits get fucked- 3cams.eu
138	Bokep Streaming trim.0337FE44-372A-415A-8237-46639DE8CEE2.MOV
139	Video Bokep Teenbitch takes off all clothes sexy teen cunt
140	Bokep Online Ebony Doggy Style
141	Download Bokep Sexy striptease and masturbation —- FULL vide…
142	Nonton Video Bokep Masturbating with new vibrator from Wishlist.Bl…
143	Video Bokep Sex Girl dildo
144	Bokep Sex boss ki Biwi ne mere lambe lund par baith khub …
145	Bokep Sex Kehlenfick und Sex ohne condom mit Mulattin tee…
146	Bokep Porno NRI Indian Bhabi Giving Blowjob to her lover
147	Gratis Bokep multiple sluts creampied in gangbang
148	Gudang Video Bokep I got this dirty wife at ihooknow.com and pound…
149	Gratis Bokep Streaming Big Tits Tattoed Hottie Playing With Some Toys
150	Download Bokep Boss and his cuteemploye
151	Nonton Video Bokep Streaming InnocentHigh – Riley Star Fucked By Creepy Teacher
152	Bokep Porno VRHUSH POV sex with Abigail Mac in VR
153	Bokep Online Brazzers – Mommy Got Boobs – (Ariella Ferrera, …
154	Bokep Porno Teen watching porn movie and masturbate
155	Bokep Japanese Ass worship with a horny little redhead from pr…
156	Bokep Online Smuk Teenager Viser Sin Glatte Fisse
157	Bokep 3gp Getting her sweet sexy lips around that hung du…
158	Bokep Indo Amber Lily in leopard panties masturbates her p…
159	Gudang Video Bokep Shame! Vira Gold fuck his cheeky stepsister on …
160	Bokep Jepang Over the Top Stinkiness preview
161	Bokep Japanese BLACKEDRAW PAWG Is Not Ready For The Night To End
162	Bokep Indo www.livepeepshowcams.com #01
163	Bokep Porno daryna Casting-20160709
164	Bokep Jepang Bbw Backshots
165	Gudang Video Bokep Streaming Cheyenne long slurpee session
166	Bokep Lovely Amateur Barely Legal Couple Blowjob 1635…
167	Bokep Porno Blowjob on his big black cock from his POV usin…
168	Bokep Porno fucks neighbor while wife in the kitchen CamsGi…
169	Nonton Video Bokep Streaming Girlfriend Drinks Piss and Eats Cum! – Compilation
170	Video Bokep Tits
171	Bokep Indo Slut fisted and pissed on
172	Gudang Video Bokep video six wahda skhikhna 2018
173	Bokep 3gp Freaky Alex poked and dressed up by the Strap O…
174	Bokep Porno Sexy Lingerie and Dildo
175	Bokep Porno SPY My Stepsister Lotioning her Body after show…
176	Bokep Porno Lesbians Angel Blade & Ella Hughes Pleasure The…
177	Bokep Sex Esperienze di signore prosperose – Experiences …
178	Bokep Super Hupen!!!! Presenting the tits of Alexa
179	Bokep Streaming masturbating and cuming
180	Download Bokep Streaming Two chubby amateur lesbians make out and kissin…
181	Bokep Indo Teasing and fucking in the bedroom with Lolly Ink
182	Bokep Selah Rain and Scarlett and D wise
183	Bokep Teen Kimber Lee Sucks & Fucks Cop to Get Away w…
184	Nonton Video Bokep trim.621FB547-09B4-42F2-A7E4-08714CA7EEA8.MOV
185	Gratis Bokep biggest clit in world
186	Download Video Bokep Lesbian Wrestling Cheyenne Jewel Farts on Loser…
187	Bokep 3gp Lovely Granny with Glasses Free Webcam Porn HOT…
188	Gudang Video Bokep Beautiful Boobs Masturbation How I Took His Vir…
189	Bokep Porno The Deepest Bollywood Passion
190	Bokep Jepang Big Bra Mom 40HH.MP4
191	Video Bokep Korean Sexybbwjen sucking good dick
192	Bokep Indo Babe Sandy Ambrosia bound whipped vibed machine…
193	Nonton Video Bokep Son’s Point of View 2
194	Bokep Porno Mature goddess sucks him off
195	Bokep Sucking Big Find this sexy Girl on Day4fun.com site and Con…
196	Bokep Jepang Elsa Jean has some hot lesbian sex with her friend
197	Gratis Bokep Streaming Premium Bukkake – Spanish model Silvana swallow…
198	Bokep Jepang mefucking white bitch
199	Bokep Online Avatar: Toph Getting Anal Fucked By Momo Sex Loop
200	Gratis Bokep Streaming Machine loving lesbians fisted in asshole
201	Bokep Japanese Busty Babe Angie Fucks With Her new Dildo Weari…
202	Bokep Japanese Granny With Extremely Hairy Pussy Gets Fucked
203	Bokep Pinkfriday Bathtub Play
204	Gratis Bokep Young goth teen brutally ass fucked in chains
205	Video Bokep Japanese Mistress Vs Wife Deathfight Humiliation Domination
206	Bokep Streaming Touchme
207	Bokep Japanese Naughty teen is cheating on her boyfriend with …
208	Nonton Video Bokep Sexy legal age teenager gets buck naked and giv…
209	Video Bokep Hot Fetish – fuck a nice Ebony Girl
210	Nonton Video Bokep Streaming 41Ticket – Miu Aizaki’s Jail Cell Gangbang (Unc…
211	Video Bokep Hot Big boobed get fucked hard
212	Bokep Korean Aruba Jasmine Daddy Issues
213	Bokep 3gp Beautiful Young Chubby Teen whore having a bubb…
214	Download Video Bokep Fit Body – Watch me masturbate while sweating i…
215	Bokep Jepang BANGBROS – MILF Teacher Ariella Ferrera Helps Y…
216	Download Video Bokep Blonde with headphones wants cum
217	Video Bokep Online Sara anal and cumshot face
218	Bokep Online Busty Roxi Miller put her milk to caffe
219	Download Bokep Madhuri Sexy Indian Bhabhi Nasty Cock Sucking &…
220	Download Video Bokep Faketaxi Free HD at Fake69.com
221	Bokep Indo 1497917850589s
222	Bokep Online JuicyCashhh
223	Nonton Video Bokep Streaming Sister got horny after caughting Bro – FREE Fam…
224	Bokep Sucking Big Swedish Girlfriend rides my big cock
225	Gratis Bokep Streaming 5d7db607-57af-4109-b25a-0ec67b4556a4
226	Bokep Streaming Russian sensation takes it in both holes
227	Download Video Bokep YouPorn – From the office attache case to the l…
228	Bokep Indo VANESA HUGE MASSIVE NATURAL WEBCAM BOOBS TITS
229	Bokep Jepang CherrySoda: The Lost Tapes – Volume One
230	Bokep 3gp Webcam girl makes herself cum
231	Nonton Video Bokep IMG 7996.MOV
232	Bokep 3gp syren smiles
233	Video Bokep Fresh babe and her good ally had a threesome wi…
234	Bokep Streaming Hot milf Betty smokes and pussy worship
235	Gratis Bokep EXPOSED CASTING – Sexy Indonesian Killa Raketa …
236	Bokep Porno Sucking a big cock
237	Nonton Video Bokep Two Horny Cam Girls Sucking Dildo On XXX Chat Room
238	Gudang Video Bokep white bbw show her big jugs
239	Bokep Ballbusting: android women (Nyssa Nevers, Emily…
240	Gratis Bokep Wild and messy teens try hot sex experiments in…
241	Bokep Japanese Melonechallenge Mea Melone challenged by big gu…
242	Download Bokep Young boy seduce hot cougar – Watch part2 on se…
243	Bokep Indo Buns baked!
244	Gudang Video Bokep Racial Humiliation & Interracail Hardcore Sex
245	Download Video Bokep Chatroulette Free Mature Porn Video
246	Bokep I love the Huge boobs on Brooklyn Chase
247	Bokep Japanese IMPREGNATING STEPMOTHER by Lady Fyre Fauxcest POV
248	Gudang Video Bokep Classical sex act by Priyamani….
249	Nonton Video Bokep Facesitting Hubby In Worship Chair
250	Video Bokep Hot she busted a nut 3 times
251	Bokep Sucking Big Indian Piss Princess drinking piss
252	Bokep Sex Pond Play with Sunny
253	Bokep Korean Indian Girls Big Nipples
254	Gudang Video Bokep Royal Handjobs- Asian 18 Yo Zoe Mathews Jerks O…
255	Nonton Video Bokep Streaming Blonde Beauty Chloé Lacourt Can’t Get Enough of…
256	Bokep Female POV Face Fuck With Messy Facial
257	Bokep Our new friend in doggystyle
258	Bokep Online 20170202 114043
259	Video Bokep Japanese Curvy Latina smacking her ass, riding and sucki…
260	Bokep Online Busty amateur GF sucks and fucks with cum on tits
261	Download Bokep Big Dick Shower Surprise For Blonde Mia Malkova
262	Gudang Video Bokep Streaming jessasbootie rides a big suction cup dildo and …
263	Bokep Online Tanned hottie with shaved cunt in the beach cabin.
264	Gudang Video Bokep Streaming Jelena Jensen Masturbates Outside on Hot Summer…
265	Bokep Sucking Big Hot blonde fucks pussy with dildo on cam
266	Bokep Sex Elsa Jean In the shower
267	Video Bokep Online Nina Kayy Miss Raquel & Betty Bang In Hot Fuck …
268	Download Bokep Streaming Watch sarithabrown from Streamate. sarithabrown…
269	Bokep 3gp 480P 600K 75923051
270	Bokep Porno 援交女套房啪啪
271	Bokep Indo Backset BJ Preview
272	Bokep 3gp IG Gaiagraphy hand job BBC for cuckold to watch…
273	Bokep Indo Fucking my pussy for you – Rosafuxxxia camshow 1
274	Gratis Bokep Streaming Lovely teen brunette degluting and riding on gi…
275	Bokep Streaming Monster Huge Butt Fucked
276	Bokep Korean LaraK
277	Gratis Bokep Streaming Antonia Sainz schoolgirl
278	Bokep 3gp Mielas spanking
279	Bokep Korean Hot naked blonde cuddling her teddy bear
280	Bokep Porno Pleasant darling and sexy mum are worshipping g…
281	Bokep Online Best Virtual Porn Games www.porn3dchat.com
282	Bokep Sex Busty blonde lesbian rims
283	Bokep 3gp Neat legal age teenager girl receives a load
284	Gratis Bokep Streaming Ferrarii Foreign Inga Chanel Oh My
285	Video Bokep Hot Hotwife being fuck
286	Bokep Stunning sex games get organized by a naughty doxy
287	Bokep Porno Candy May – I FUCK MYSELF ON MY BF’S COCK (PUSS…
288	Bokep Online PURE TABOO Blind Teen Tricked into IR Creampie …
289	Bokep Sex Japanese Orgy At Love Hotel!
290	Bokep 3gp Wet wet
291	Nonton Video Bokep Huge Homemade Teen Flashing On Webcam Show
292	Bokep Jepang Peeping the undressing of japanese teen girls i…
293	Bokep Korean Cute Brunette Tiffany – Slut Wife Final Exam
294	Gudang Video Bokep Streaming Busty stepmom pussylicked after fucking
295	Download Bokep Streaming Busty Anisyia orgasm with sex-machine
296	Bokep Sonia Baby y Dunia
297	Video Bokep Hot Hottt Webcam Girl 9Free Amateur Porn Video ab…
298	Bokep Streaming Redhead StepDaughter Marie McCray Has Rough Sex…
299	Bokep Streaming Arabic girls maturefucks with a young man at …
300	Bokep Female Cops With Massive Tits And Asses Get Ban…
301	Bokep Sex Mandy y Manu
302	Bokep Streaming Fucking his friend’s wife in his own house
303	Bokep Pervmom – Sexy Blonde Stepmom Needs Help Stretc…
304	Bokep Porno Mr. White Chocolate dominates blonde BBW
305	Bokep Online Mom relax son by blowjob
306	Video Bokep Hot pussy & clit
307	Bokep Streaming 11 secs of anal bliss
308	Bokep Streaming BLACKEDRAW Blonde girlfriend with HUGE ass pref…
309	Bokep Hot Mature Latina
310	Video Bokep Seductive babe shows off her assets and plays w…
311	Bokep Online White Couch lesbian fun
312	Bokep Japanese Buzzin
313	Bokep Korean CrushGirls – Dirty talk while I gag on a dick
314	Bokep Online TattedLust (inkythebrain) Anal Stretch Tied Up …
315	Bokep Streaming Demure babe is filled with needs as that babe s…
316	Bokep Streaming Homemade Video Of A Gash Dildoing Big Tits Milf…
317	Bokep Indo Babygirl giving Daddy head
318	Bokep Streaming BLACK4K. Repair me!
319	Bokep Porno SMiyD jessica bunny 6m
320	Download Bokep Abigail Mac masturbates for you
321	Bokep Streaming Beauty-Angels.com – Eva Fire – Lonely girlish s…
322	Bokep Porno I’m addicted to this Asian japanese brunette se…
323	Nonton Video Bokep Streaming Busty Buffy soaking in hot tub
324	Bokep Japanese JAV teen in pigtails Ruka Uehara CMNF foreplay …
325	Bokep Japanese Sexy teen brunette fucks in her moms bedroom
326	Bokep Streaming Jill Cheating does 69
327	Bokep VID-20180312-WA0003
328	Gratis Bokep a petite Russian slave girl submits to her mast…
329	Bokep Streaming Jenny Cumberland – “Jenny From The Block”
330	Bokep Porno Hot brunette pumping her boobs and pussy with o…
331	Video Bokep Hot Sexy samantha dancing and shaking ass for fun
332	Bokep Japanese Bubble Butt Blonde ZOE MATTHEWS Gets Fucked By …
333	Video Bokep Horny Student Kimber Lee Punished By Principal …
334	Nonton Video Bokep Streaming Horny Aussie Mom From Canberra
335	Download Bokep BBW CASSANDRA FUCKED HARD
336	Bokep Indo SUPER HOT CAMGIRL FUCKS HER HOLES ON WEBCAM
337	Bokep 3gp Hot sex with sweet bitches looks simply incredi…
338	Gratis Bokep Eva Orlowsky and other legends of italian vinta…
339	Gudang Video Bokep Streaming Sabina nude in public
340	Bokep Indo BLOWN AWAY
341	Download Bokep Sandra Parker gets pumped
342	Bokep Film: Bella di giorno Part. 1 of 3
343	Bokep Indo Delightful amateur babe sucks her paramour and …
344	Bokep 3gp My First Amateur Video On Cam showing my Ass ( …
345	Gudang Video Bokep Streaming BANGBROS – Stepmom Chanel Preston Catches Son J…
346	Bokep Porno Bang Glory HOLES!
347	Gratis Bokep Streaming MISTRESS MIRA – EXTREME CUCKOLDING GANGBANG PARTY
348	Bokep ORAL
349	Video Bokep Hot blonde lesbians sisters fuck with strap-on!
350	Bokep Sucking Big roxana-xrated – Jerk Off Countdown in 5 Minutes!
351	Bokep Online Starfire squirt
352	Bokep 3gp A Blowjob To Remember
353	Gudang Video Bokep Sunny Lane Drives You Wild With Lust
354	Download Video Bokep What is her name? Where can i find the full vid…
355	Bokep 3gp Great Ass Kristina Rose Gets Anal Punishment
356	Bokep Korean Jeny Smith public nudity on the road
357	Bokep Sex Getting my wife’s asshole ready for some dick
358	Bokep 3gp Toying my pussy until I cum, LittleCandyland
359	Bokep Online Vivid Parody – Vader shows Leia the power of th…
360	Gudang Video Bokep Streaming Taking a hard pounding. Because she asked:)
361	Bokep Japanese HotWifeRio Waking up son´s friend fucking with mom
362	Bokep Online Pussy Play ; PolyFreakShay
363	Gratis Bokep Ally Tate & Alexis Deen sexy girls firnger fuck…
364	Bokep Porno Cousin Ouis oral education part 1
365	Bokep Online Naughty lesbian fucks young lover with zucchini
366	Bokep Sucking Big Sex in stockings and through pink panties
367	Gudang Video Bokep Mike Adriano fucks a busty MILF Ryan Conner
368	Bokep Fucking my BBW wife missionary with her legs up…
369	Bokep Sex Ass fucked babe shares fat POV dick with her ta…
370	Bokep Porno He came all over my face Twice
371	Bokep 3gp Big Naturals bouncing up and down in 4K Ultra H…
372	Bokep Japanese Anal Amoeba: PAWG gets slimed and assfucked (Pa…
373	Bokep Online Super Thick white bbw walking pt. 2
374	Bokep 3gp My breasty love made a show – pregnat milf(Quee…
375	Download Video Bokep FMD 0848 04
376	Bokep 3gp fist 1
377	Download Bokep Streaming Live (2017) – Lat HDTC V2.MP4
378	Bokep 3gp Petite babe gets eaten
379	Bokep 3gp Slut takes it in every hole
380	Gratis Bokep Knocking me off
381	Bokep Porno SLIM ELEGANT BEAUTY GETS ORGASMIC SEX LESSON BY…
382	Bokep Streaming Lovely chick is having fun engulfing and riding…
383	Bokep Porno La Toya Lopez fucked hard – www.xslovenke.si
384	Video Bokep Korean FILF – Dreaming About My Step Daughter
385	Bokep Porno Nikki Brooks feet in your face
386	Gudang Video Bokep Streaming Elena Koshka rides cock of friends Dad
387	Bokep Indo Beautiful euro brunette Kattie Gold twat wideni…
388	Bokep Porno Hot BBW Playing Pussy – 88cams.xyz
389	Download Video Bokep VID-20180313-WA0001
390	Bokep Streaming busty brunette toys in ass on cam – www.sexcam3…
391	Nonton Video Bokep TU VENGANZA – Busty Colombian Anastasia Rey enj…
392	Gratis Bokep STEP MILFs POV threesome
393	Download Bokep Sensual lesbians Amirah Adara and Suzy Rainbow …
394	Bokep Japanese Curly Hair Hardcore Orgasm FIND HER at WhoreCam…
395	Download Video Bokep Scarlett Rose customFetish.com
396	Bokep Indo Cuckold Giantess sucks Giant Cock
397	Gratis Bokep Beauty experiments of a hot chick in fucking – …
398	Download Video Bokep Girl In White Stockings
399	Bokep Sex Swedish girlfriend gets fucked
400	Nonton Video Bokep Streaming Girl masturbates on webcam – INSTASEXCAM.COM
401	Download Bokep Streaming Stripper Taken Home for $200
402	Bokep Streaming Sofi Ryan Seduces Davina Davis At Her Home
403	Bokep Mouth Cumshot Amateur Blowjob Closeup
404	Bokep 3gp Indian pornstar Sahara double penetration three…
405	Bokep Porno Sex with my wife amateur adult xxx reallifecam …
406	Bokep Indo Gemma Minx toying her pussy
407	Bokep Sex Horny teen fucks tutors huge dick
408	Video Bokep Japanese Nasty hottie is pissing in mouth of her gf whil…
409	Nonton Video Bokep Streaming Naughty Niece Wants to Fuck Her Favorite Uncle
410	Bokep Porno Mature blonde Carla G licking fresh young pussy
411	Bokep fucking my ex co-worker with a fatt ass
412	Gratis Bokep Femdom Worship JOI Goddess Jade
413	Bokep Streaming Teen Pia Casting – The first time in front of t…
414	Bokep Sucking Big Vintage Annabelle Flowers Doggie
415	Bokep Indo Sleepin dick down wit creampie ft. My latina mami
416	Gratis Bokep Tight Anal Big Facial
417	Download Bokep Streaming Lesbians POV in bathroom, BBW fucks a bottle of…
418	Bokep Japanese El culo mas grande y perfecto destrosado por en…
419	Bokep Streaming Hairy Goth Mari Plays with her Huge Nipples in …
420	Bokep Jepang Whats inside
421	Download Bokep Streaming Mature subslut deepthroated and fucked
422	Bokep Porno Webcam homemade fucking
423	Gratis Bokep Streaming Hot Bro Fucks Hot Sis When Parents Aren’t Home
424	Nonton Video Bokep Streaming Cumfortune Cumshot compilation
425	Download Bokep Streaming Taylor Vixen Plays With Her Amazing Tits And Pussy
426	Download Bokep Streaming HDVC368-dirtyteeny-full
427	Bokep Cheer leader getting her pussy handled by a ran…
428	Bokep Korean 904099
429	Nonton Video Bokep Anime Hentai Style Up Skirt Flashing by Jeny Smith
430	Gratis Bokep Foot job in nylons Fisted pussy and Cummed good…
431	Bokep Japanese Gorgeous glamorous girl gets crotch licked then…
432	Bokep Porno VID 20150616 112036
433	Bokep Indo Claudia Smith Disfruta la Lechita Caliente !!! …
434	Nonton Video Bokep Streaming Redhead Slut Rough Slapping/Masturbation
435	Bokep Indo Claudia Smith Disfruta la Lechita Caliente !!! …
436	Bokep Sex Playgirl gives head stimulating clit and gets b…
437	Bokep Porno Hairy Pierced MILF Loves Vibrators
438	Bokep Jepang Nathan0Nancy
439	Bokep Porno Let Him Do It Or Jail For Sultry Teen Thief
440	Bokep Korean Self-spanking and pussy play
441	Gudang Video Bokep Streaming Banging His Sinful Stepma Krissy Lynn
442	Video Bokep Japanese calentona
443	Video Bokep Sex Fabulous body teen teasing with long muscles legs
444	Download Video Bokep 17 camille
445	Gudang Video Bokep Streaming Shy Japanese College Girl
446	Bokep Streaming flyb1gt1t5n0w 2018041 40615
447	Bokep Korean Girlfriend gives boyfriend a heavenly BJ
448	Download Bokep Streaming Nice Ass Amateur Drilled
449	Bokep Online MAMADA EN EL TREN
450	Download Bokep Streaming Lbdee deepthroat bbc swallows cum
451	Bokep Indo Teen Emily gets nailed by senior Jeffrey
452	Bokep Jepang 20170402 045531
453	Download Bokep Streaming Tan Blonde Natalia Starr Dildo Bangs Sweet Puss…
