	0
1836	Bokep 3gp Amateur Veronika and her huge plastic friend
1837	Bokep Japanese Orgasm
1838	Bokep Porno 松原麻衣
1839	Download Bokep Mexican latin is such a whore!
1840	Bokep Japanese I found this slutty wife at tohorny.com and we …
1841	Bokep Korean brunette vanessa get’s it deep before cum shot
1842	Video Bokep Japanese 7Y Vk11Uu0k-1479105631-1.54.0
1843	Bokep 56y GILF Amber Connors Squirts in Hotel Stairwell
1844	Bokep Korean camclip-3
1845	Bokep Sex Xxxxddddf
1846	Download Video Bokep Strip Club lesbians
1847	Bokep 3gp We love filming ourselves. I hope you masturbat…
1848	Download Video Bokep Snakes and Ladders Part 2 feat. Pixie Pulsar
1849	Download Bokep Streaming Latino makes me cum plenty and gives me huge fa…
1850	Video Bokep 3gp Me and ay wife
1851	Bokep Streaming nh.MP4
1852	Bokep Online ALL ABOUT JASMINE SCENE 3
1853	Video Bokep Japanese Mature blonde MILF sex with young guy under the…
1854	Bokep Japanese danish Yeni Luv anal’s Cam Show Cha
1855	Bokep Online 18 Year Old Gags On Her First BBC with Facial
1856	Video Bokep Korean Amateur Teens Masturbating Compilation – More o…
1857	Bokep Sucking Big Hot blonde masturbating with 2 toys
1858	Bokep Korean VID 20140630 110602009
1859	Bokep Porno Dani Daniels Looks Amazing
1860	Bokep Streaming Girl Of Many Talents
1861	Bokep Indo All dicks love good handjob, so have a fun this…
1862	Bokep Sucking Big Cute Shy Teen Toys 4
1863	Bokep Sucking Big Episode 6 – Aria Alexander & Lea Lexis
1864	Download Video Bokep Candy Camilly Hotwife Amateur
1865	Bokep Beautiful russian hottie Alina teasing in sexy …
1866	Bokep Sucking Big DILDO FUCKING LATINA
1867	Bokep 3gp Amy-Honey-Cute- woman sexy on lingerie
1868	Bokep Porno Romantic honey is ready for the first sex of th…
1869	Bokep Online My Son’s Big Boner
1870	Video Bokep Hot Pinup Doll
1871	Gratis Bokep Slutty wife shared with a friend threesome
1872	Bokep Sucking Big Le encanta que la haga gritar
1873	Bokep Porno Babe wants to play with her pussy in bed
1874	Bokep Sucking Big Classic Gangbang 2
1875	Download Bokep Streaming 2 SUM ON COUCH
1876	Bokep Porno Elay Smith 5
1877	Bokep Passionate Real Sex and orgasms – Charisma and …
1878	Download Video Bokep Lil Debbie
1879	Download Video Bokep Double penetration with dildo and glass toy ana…
1880	Bokep Sucking Big Diamond Kitty fille her tight holes with a swee…
1881	Video Bokep Sex young neighbour girl
1882	Bokep Japanese Blonde bimbo whipped on casting
1883	Download Video Bokep Hairy pussy teasing with Gemma Minx
1884	Bokep Indo 20161104 042251
1885	Bokep Sex Claudia Antonelli from Italy
1886	Bokep Sex Half Hour Hitachi Squirting Preview
1887	Bokep BUSTY milf with shy guy at their first casting
1888	Bokep Sucking Big gozando rico de un buen polvo de perrito
1889	Bokep Online Young Nordic cute tiny blonde amateur milf home…
1890	Gratis Bokep White Girl Pleasures Herself – cutecam.org
1891	Gudang Video Bokep Streaming Juli Ashton and blonde in lesbian action
1892	Gratis Bokep Streaming Sexy lesbian gets sweet pussy licked and ass dr…
1893	Gratis Bokep beverly hill 20042018 0109 female Chaturbate
1894	Bokep Streaming Liz Vicious Anal
1895	Bokep Korean Bettina Dicapri use sex toys to get orgasms
1896	Bokep Indo quiero una colombiana
1897	Bokep Korean Gorgeous Blue Eyed Teen Loves Cock POV
1898	Bokep Japanese FILTHY FAMILYthings we do at MY HOUSE
1899	Bokep Porno found my naughty step mom on nowhook.com and fu…
1900	Bokep Accidental Cuckold II – Meana Wolf
1901	Bokep Korean White wife ass fucked!
1902	Bokep British stockings milf creampied in ffm
1903	Download Bokep Streaming Fucking my Chubby Sister Ft Brad Borrelli
1904	Bokep Sucking Big Ulf Larsen pee, flash, wank and orgasm for two …
1905	Bokep Online BadMILFS- Busty Teen Joins StepMom For Threesome
1906	Bokep Online SWALLOWED Two stunning busty milfs gagging on a…
1907	Bokep Online big juicy booty
1908	Nonton Video Bokep Streaming Fiona Sweet
1909	Bokep Japanese KATANA SWORD SHOOT 6 mins bts voyeur pussy
1910	Gudang Video Bokep Streaming Very horny hot teen can not wait to get a stiff…
1911	Bokep Online Tied up and Fucked
1912	Bokep Japanese NAKED SHOWER GOOD WASH
1913	Nonton Video Bokep I am just the girl next door in tight skinny jeans
1914	Download Bokep Streaming Red Hot Girlfriend Harlot
1915	Bokep Online Sunny Lane is Booty Shaking For You
1916	Gudang Video Bokep Heidi’s Retirement Party
1917	Bokep Indo DOUBLEVIEWCASTING.COM – TONYA GETS HER NATURALS…
1918	Bokep Streaming Agnieszka nude in public
1919	Download Bokep I fuck Australian Girl from BITCH18.COM
1920	Download Bokep Pornstar Anna Malle being fucked hardcore
1921	Bokep Korean Christy Mack shows off her hot body
1922	Bokep Porno the smell of sex
1923	Bokep Indo Stephany Moon Goes Anal
1924	Bokep Japanese Caress gets butt fucked
1925	Bokep Porno xvideos.com 2ecf844ca031bf21cc05922a7ce98068
1926	Download Bokep Streaming Cam Girl In Glasses Sucks And Fucks Her Dildo
1927	Nonton Video Bokep Streaming Lance.mccurry27 and StarrDecember Close Up and …
1928	Bokep Porno Melissa Falko self sex on the whater
1929	Bokep Korean Arab wifey shows her hairy twat
1930	Bokep Porno La Pepina Chilena hot latina masturba con ducha…
1931	Bokep Sucking Big 20170817 175654
1932	Nonton Video Bokep Horny aged man is eagerly fucking a slutty teen…
1933	Bokep Ultra Fit nympho Jasmine Jae Fucked In Interrac…
1934	Bokep CLIP CORAL 2
1935	Nonton Video Bokep Streaming BLACK4K. Sexual pleasures with a black guy at t…
1936	Bokep Streaming Busty Blonde Babe Pussy and Dildo
1937	Bokep Naturally Busty Raven MILF Cumming-240p
1938	Bokep Jepang Latex Babe Rubber Doll Abuses Succubus With Den…
1939	Bokep Indo Hot Danika Mori Anal Action From PORHUB
1940	Download Bokep Anal destruction of Cherry Kiss
1941	Bokep Korean Amanda Bryant ceampie
1942	Bokep Japanese BBW mixed wrestling
1943	Nonton Video Bokep Streaming G0zGH-0MRTdHxreZ
1944	Bokep My Curvy Wife Is Drop Dead Gorgeous! The Hottes…
1945	Bokep Indo indian babe ready for sex.hot romance. full vid…
1946	Bokep Sex Worship Big boobs in sexy lingerie
1947	Download Bokep Streaming mia-malkova-full-hot-service-720p-tube-xvideos
1948	Video Bokep Japanese Dani Daniels has hot lesbian sex with Cherie De…
1949	Gratis Bokep Apple Booty Olivia Fyre & The Curse of Prematur…
1950	Gudang Video Bokep Sister and friend taped
1951	Download Bokep Streaming Adela-Rioss-Super woman sensual
1952	Bokep Indo Japanese busty girl enjoy masturbationafter t…
1953	Bokep Valentina Ricci hot mom in stockings ger her pu…
1954	Bokep 20171205 063810
1955	Bokep Indo xvideos.com 11cd7fbcb4b0024b61fc0549e1c7b8bc
1956	Bokep Korean Wife Sucks Dicks Better Then Cheatting Husband …
1957	Download Bokep Delivery of packages for Jennifer
1958	Download Bokep Streaming Pornstar Missy Maze gives asscrack addict blowjob
1959	Video Bokep Hot AliValentine is a Sexy cat
1960	Bokep Masturabating
1961	Bokep Sex Hot Nurse Sucking My Cock
1962	Bokep Jepang For Sale
1963	Bokep Indo Taylor ST. Claire — möchte vom Saft immer mehr…
1964	Bokep Sex POV Foot JOI 7 TRAILER
1965	Bokep Japanese cream pied the wife firs time in 5 years
1966	Bokep Getting Naked and Using My Dildo!
1967	Bokep Japanese Linda Colombiana masturbandose (Squirt).
1968	Bokep Streaming Monica Santhiago Home Made Spanking
1969	Bokep Sex BBW Simple Saturday [HOMEMADE]
1970	Gratis Bokep Streaming Victoria Milk Lactating Milk Play Compilation
1971	Gratis Bokep Girlfriend Aurelly Rebel gets her Asshole Fucke…
1972	Download Video Bokep Tiny schoolgirl milf Brit pees herself in despe…
1973	Bokep Streaming Masked girl stripped
1974	Download Bokep Streaming Taylor-Burton Cumkitten
1975	Download Video Bokep Rimming, toying, and a mouthful of cum
1976	Gudang Video Bokep Streaming jordan 30 sec clip
1977	Bokep Porno Hot brunette lesbo chicks take turn eating tigh…
1978	Bokep Korean Hot Indian Couple Fucking in Sexy Lingerie
1979	Download Bokep Top babe Sandy Ambrosia tied and vibed hard til…
1980	Bokep Porno BBW on Kamasutra chair
1981	Gudang Video Bokep Streaming Mea Melone got Bath from newcomer’s Jizz Shower
1982	Bokep Sucking Big PervCity Asian and Latina Blowsandwich
1983	Gudang Video Bokep BF Has Magic Fingers! He Can Make Me Squirt In …
1984	Video Bokep Hot Scarlet Rose cum shot
1985	Bokep Japanese beautiful italian girl
1986	Bokep Online Webcam Sexy Chick Takes a Hhuge Dildo
1987	Bokep Online Small amateur Chick Stepsister eager to swallow…
1988	Gudang Video Bokep Streaming Sexy brunette in fishnets gets throatfucked, we…
1989	Bokep Japanese Pedicure Feet pinkfriday
1990	Bokep Streaming Kitty Purrz wearing her favourite stockings
1991	Bokep Streaming Abigail Mac Hot Threesome
1992	Bokep Indo Empera Teen hoot Russian girl homemade pornstar…
1993	Video Bokep RealityKings – RK Prime – Penis Games
1994	Download Bokep Intense scenes of Japanese sex with Ria Sakurai
1995	Bokep Streaming Heavy pierced slave – pussy and nipples
1996	Bokep 3gp 20170722 220229
1997	Download Bokep Streaming Coco goin in
1998	Bokep Indo teen kriisrus playing on live webcam– find6.xyz
1999	Bokep Indo I’m your mother
2000	Bokep Japanese Massage Therapist Gives BBC Happy Ending
2001	Download Bokep Streaming Young, filth and so eager for cock! Vol. 22
2002	Bokep Jepang POV Blowjob in a Bathroom with Cumshoot
2003	Bokep Indo Real orgasm in bed amateur teen hidden cams Rea…
2004	Gratis Bokep Getting A Blowjob From A Lonely MILF
2005	Bokep Korean VID 20150322 162323
2006	Bokep Porno Glam models lesbo threesome with toy analplay
2007	Bokep Convo and blowjob by depressed girl
2008	Bokep Indo Shoejob with DC shoes
2009	Nonton Video Bokep Streaming 3D Comic: Legacy. Episodes 28-29. Magesleep…T…
2010	Bokep 3gp Add Me on Snapchat Username ArdenJadeFree
2011	Nonton Video Bokep Streaming Tyler Lee got sucked his big cock so good
2012	Gudang Video Bokep Streaming The ladies are turned on
2013	Bokep Porno Brutal Casting Couch Compilation Fetish Video D…
2014	Bokep Streaming TattedLust Gives Sloppy Head On Balcony (short …
2015	Bokep Sucking Big Skinny cocksuker – POV
2016	Video Bokep FisterTwister – July Sun and Lexi Dona
2017	Bokep Sucking Big Helena Price Mom Makes Son A Champion Part 5
2018	Bokep Indo Hot action in monastic cell
2019	Bokep Porno masturbating on the phone
2020	Bokep Streaming Sensual lesbians Lola Myluv and Lina Arian in s…
2021	Bokep Indo TOUR OF BOOTY – Don’t Judge Us, We Were Horny a…
2022	Bokep Porno Melissa Candy wear green body stoking and play …
2023	Bokep Streaming chaturbate lulacum69 18-04-2018
2024	Bokep Indo Heather big tit baby oil exploring
2025	Gratis Bokep Streaming JAMAICAN COLLEGUE FUCKED ME SO GOOD IN THE CAR!…
2026	Download Bokep Streaming Horny Bella fuck his pussy and squirt
2027	Bokep Streaming Asian School Girl Taught Cock Sucking
2028	Bokep Porno Ramming it up the ass of an anal maniac
2029	Download Video Bokep The chair fucks my hairy pussy and anal, perver…
2030	Bokep Sucking Big BOOTYDESIRE.COM SKYLER NICOLE HARD FUCK
2031	Bokep Indo Liz Vicious Loney Dinner Party Great Masturbation
2032	Gudang Video Bokep Streaming fucked my friends mom after I found her on tona…
2033	Bokep 3gp Shooting Star – gangbang your wife it’s better …
2034	Gratis Bokep Streaming Blonde Brit Babe Jodie shot in 4K Ultra HD & Sl…
2035	Bokep Sucking Big xvideos.com 569f03e739605d252afb6987efc77b8d
2036	Bokep Korean Julia de Lucia & FRanceska Dicaprio bdsm anal r…
2037	Bokep Jepang Chubby BBW fucking dildo and cumming
2038	Bokep Korean Mexicana Squirter
2039	Gratis Bokep shinylove bigbigbangs shinylove2
2040	Nonton Video Bokep Nude on vacation with her ass tan
2041	Bokep Porno Bangladeshi Chittagong Debor and bhabi having s…
2042	Gratis Bokep Streaming BURP @ 8:58 Juliet Uncensored BTS Shawl Dance
2043	Bokep Sucking Big VRCosplayX.com Natural Latina Apolonia Lapiedra…
2044	Bokep Porno Alluring brunette hair teen moaning sweetly as …
2045	Bokep Japanese Dildo actiom
2046	Gratis Bokep hot deepthroat sex with Christen Courtney
2047	Download Video Bokep BLACKEDRAW Euro Girl Finally Gets To Try Out Ma…
2048	Download Video Bokep Chubby teen slut teases daddy
2049	Video Bokep Wife RealityLovers – Teen Fantasies in Sin City
2050	Download Bokep Streaming Nicole Aniston teases you
2051	Nonton Video Bokep Super hot lesbians playing with each other
2052	Bokep Online Lexidona – Fitness – Pornstar
2053	Bokep Indo GOFUCKAGIRL – Vira Gold fucking Danco in ass an…
2054	Bokep Japanese ePornik – The place where yo…ife!3.flv http:/…
2055	Bokep Sex Black BBW Model Tiffany Shakes Big Ass
2056	Video Bokep Logans Run Fucking-Redhead-feat-Autumn-Rain
2057	Bokep Jepang Sexy and Plump
2058	Bokep Streaming Office worker getting some juice up as her work…
2059	Bokep Online 20160701 223545
2060	Bokep 3gp Paid teen sucks in car
2061	Gudang Video Bokep Annabelle Flowers Vintage Anal Role-play
2062	Bokep Dandole duro en 4 a la pony loca | Los Ponnys L…
2063	Bokep Hot babe oiling her body and fingering herself
2064	Bokep MissHot free webcam show 2016 January 06-15.46 …
2065	Bokep Online Russian real teen Veronica Snezna in the kitche…
2066	Bokep Online Breathtaking beauty enjoys beinng manhandled an…
2067	Video Bokep Hot Magda – Hottest Czech Redhead Teen Casting
2068	Download Video Bokep Intense Fuck With Big Oiled Booty!
2069	Video Bokep Hot Massive Home Orgy Taking Place And This Is The …
2070	Bokep Porno Hot Booty dance with cute (russian) teen – Kitt…
2071	Bokep Streaming PHILAVISE-Gamer gets a fuck
2072	Download Bokep Streaming Cougars Watch Their Friend Get Hard Fucked By B…
2073	Video Bokep Korean Adorable little feet stroking a big cock
2074	Video Bokep Korean Teen with Hitachi Magic Wand
2075	Bokep Sucking Big hot girl masturbating and cumming hard in a vid…
2076	Bokep Online Amina Sky Getting an extreme Asshole Tattoo
2077	Bokep Japanese Young blonde gets good fuck and Gets orgasm mul…
2078	Gratis Bokep Throating facialized ho
2079	Bokep Online double ass
2080	Gratis Bokep Little bald freak
2081	Bokep Caroline luder
2082	Video Bokep Japanese Blowjob in the Train –Argentina Amateur
2083	Bokep Porno His Milk Maid Preview
2084	Bokep Streaming my desi wife playing with ice cubes
2085	Bokep Japanese MIRA CUCKOLD – HOMEMADE ASS TO MOUTH CUCKOLD HU…
2086	Video Bokep Japanese Danika Mori hot anal day
2087	Bokep Streaming Blondie Enjoys Kinky Bdsm Threesome
2088	Gratis Bokep Streaming 3D Busty Animated Blonde Hardcore Sex Game
2089	Bokep 3gp Florencebigsizebb from Chaturbate
2090	Bokep Japanese Beso negro y cogida a esposa
2091	Bokep Online Private Sessions #1 (Official Trailer)
2092	Bokep Korean Gorgeous Cassandra Cruz and Jaslin Diaz are you…
2093	Bokep Sucking Big Rough finger-fucking among 3 lesbians feat. Cou…
2094	Video Bokep Rough breast handling
2095	Download Video Bokep Teen pornstar Kasey Warner wishes for black cock
2096	Bokep Jepang Blowjob in the Train –Argentina Amateur
2097	Bokep Jepang His Milk Maid Preview
2098	Bokep Japanese my desi wife playing with ice cubes
2099	Bokep Indo MIRA CUCKOLD – HOMEMADE ASS TO MOUTH CUCKOLD HU…
2100	Bokep Japanese Danika Mori hot anal day
2101	Bokep Indo Blondie Enjoys Kinky Bdsm Threesome
2102	Bokep Indo 3D Busty Animated Blonde Hardcore Sex Game
2103	Gratis Bokep Florencebigsizebb from Chaturbate
2104	Bokep Porno Beso negro y cogida a esposa
2105	Bokep Anisyia fucks in doggystyle
2106	Bokep 3gp Zelda’s cream pie surprise
2107	Video Bokep Japanese kendrapaker- sexy
2108	Bokep Porno Hot blonde Sofi screaming during orgasm from se…
2109	Nonton Video Bokep ZOE ZANE LOVES HER FANS
2110	Bokep Jepang Busty Blonde Teen Goes Anal
2111	Bokep Indo Groupsex at the gynecologist
2112	Bokep Sucking Big Legend Nautica Thorn
2113	Bokep Streaming got this horny wife at ihooknow.com and we cum …
2114	Bokep 720p promo 01
2115	Gudang Video Bokep BangingBeauties Asian Sluts Asa Akira and Jayde…
2116	Bokep Streaming Roomate SPH with LittleRedPanty
2117	Bokep VID 20170505 161009
2118	Gudang Video Bokep Streaming Massive Dick for Sexy Teen Jessie Lynne
2119	Bokep Sex ZOE ZANE LOVES HER FANS
2120	Bokep Busty Blonde Teen Goes Anal
2121	Bokep Japanese Groupsex at the gynecologist
2122	Download Bokep Streaming Legend Nautica Thorn
2123	Download Video Bokep got this horny wife at ihooknow.com and we cum …
2124	Bokep Porno 720p promo 01
2125	Bokep Japanese BangingBeauties Asian Sluts Asa Akira and Jayde…
2126	Bokep Roomate SPH with LittleRedPanty
2127	Download Bokep Streaming VID 20170505 161009
2128	Gratis Bokep Massive Dick for Sexy Teen Jessie Lynne
2129	Bokep Sex Best British Pornostar Compilation
2130	Bokep 3gp Korean College Girl teasing with wet panties Cu…
2131	Bokep Japanese 23191423 859804557527116 7885369164418777088 n
2132	Bokep Best juicy squirt you have ever seen
2133	Bokep 3gp Aroused Whore Floozy
2134	Video Bokep Japanese Clips of Jodi sucking cock like a champ (Jodi N…
2135	Gratis Bokep Squirt Eyaculación HD
2136	Bokep Japanese Mayuka Akimoto fucked and made to swallow fresh…
2137	Bokep Jepang Pregnant
2138	Gudang Video Bokep Natural Tit Teen Casting
2139	Nonton Video Bokep Wonderful red haired cockgobbler deepthroats an…
2140	Download Bokep Streaming Double BJ fun With Kirsten Price
2141	Bokep Streaming Cocoa Ayane sucks the cock dry after a serious …
2142	Bokep Streaming Dijon twerk and pussy play
2143	Bokep Jepang Chonga Fucked by White Cock
2144	Bokep OLD4K. Wet fucking action in the jacuzzi with a…
2145	Bokep Korean Brazzers – Big Tits at School – (Nino Polla) – …
2146	Gudang Video Bokep sexy wife amber blank forces husband to film he…
2147	Video Bokep Caliente su culo otra vez
2148	Video Bokep Korean trailer x videos pies yoha
2149	Video Bokep Korean InterracialPlace.org – Blonde trophy wife fucks…
2150	Bokep 3gp Ride Em Cowboy
2151	Bokep Glasses Cam Girl Tries Her New Lovense Vibrator…
2152	Bokep Porno Helping Stepsis
2153	Bokep Korean Alexotis y Mihaela se lo montan en la playa de …
2154	Download Video Bokep Foreverlicious Bangkok Hotel sex
2155	Bokep Japanese Kendra Cole has a hot lesbian experience!
2156	Gudang Video Bokep BLACK ANGEL EBONY LOVES WHITE DICK THE BEST KIND
2157	Bokep 3gp Good Night Story by Sapphic Erotica – Nana and …
2158	Bokep 3gp Inked beauty gets tight asshole fucked
2159	Download Bokep Cami 18 year old college student 1st time ever …
2160	Nonton Video Bokep Papy chope une jeune salope aux petits seins av…
2161	Bokep 3gp Brunette sucks dick in woods
2162	Gratis Bokep Streaming two lesbians teens from SnapsDirty
2163	Bokep Korean Nice Asshole Penetrated Deep
2164	Bokep Sex slut hidori633 masturbating on live webcam– 6…
2165	Bokep Japanese Mom catches daughterssmokingamateur hairy p…
2166	Gratis Bokep Streaming Riding my Sybian with a mirror view from behind…
2167	Download Bokep SarithaBrown adult recorded download naked
2168	Bokep Korean Cami 18 year old college student 1st time ever …
2169	Bokep 3gp Papy chope une jeune salope aux petits seins av…
2170	Bokep Streaming NannySpy Raspy voiced Abella Danger fucked afte…
2171	Download Video Bokep Wife working on knees sucking cock
2172	Download Video Bokep Glamorous beauty assfucked and jizzed
2173	Bokep Streaming Hot pornstar gets her shaved peach fucked fine …
2174	Bokep Porno More Blowjobs by Lady Fyre
2175	Bokep Indo Vicky Wilfing creampie Gangbang party teil 2.
2176	Bokep Japanese Teen Kimber Lee Stares At You While She Sucks Y…
2177	Bokep Streaming My First BG Scene-trailer
2178	Download Video Bokep Marica strips off her costume and plays with he…
2179	Video Bokep Step mom putting on a shower in the bathroom li…
2180	Bokep Jepang Rubbing His Cock All Over Her Pussy
2181	Bokep Korean Big boob teen Paris Kennedy gets a big cock
2182	Video Bokep Hot Fazendo gostoso com o mozão
2183	Video Bokep Pretty playgirl gets a lollipop sucking before …
2184	Gudang Video Bokep Streaming Vittoria Risi & Sofia Cucci Fuck and Squirting …
2185	Bokep Porno Best slow sensual anal sex
2186	Bokep Japanese xxxmultimedia.com – Huge mom fucked good
2187	Download Bokep CutiesGalore presents Lina
2188	Bokep 3gp Trying to Fit into My Old Clothes!
2189	Video Bokep esposa gravada infraganti
2190	Download Bokep Streaming Fist Tatoo short movie amateur teen
2191	Bokep Porno Kendra Lust Impales Her Big White Ass On Giant …
2192	Gudang Video Bokep hottest lesbian act ever
2193	Video Bokep Japanese Amateur Couple Free Home Made Porn Video
2194	Download Bokep Sandra Sayer XXX FREE Mission 6K Pussy Masturba…
2195	Bokep 3gp Vídeo pornográfico HD grátis de OMG! Squirting …
2196	Bokep Sex redhead masturbating on live webcam
2197	Bokep Streaming Babe with milky skin spreads legs getting her f…
2198	Download Video Bokep Dirty Birdy, Nerdy Birdy – Teaser
2199	Bokep 3gp Mom Fucks and Sucks Son as a Going Away Present…
2200	Download Video Bokep MonicaMilf s Tower of pain – Norsk porno
2201	Download Bokep Streaming Werde Zahlmarionette Geldsklave Moneydom Paypig…
2202	Bokep Big Tit Country Girl Anal Interracial Pounding
2203	Gudang Video Bokep Ultimate French Girls 3
2204	Bokep Streaming Amazing Big Ass Blonde Wife
2205	Gudang Video Bokep Point of view nice ass
2206	Bokep Jepang Stepma And Stepdaughter Get A Huge Penis
2207	Bokep Korean Teen girl handjob and riding dick after school …
2208	Video Bokep Hot Amber plays on the Hwy
2209	Download Bokep Streaming Afghan cupel
2210	Bokep Korean Cock sucking slut gives me a sloppy seconds blo…
2211	Video Bokep Hot Teen Girl NinaDevil zeigt ihren ARsch
2212	Bokep Streaming Encased in Stockings and Fucking with Strapless…
2213	Download Video Bokep AMYCLIP9
2214	Bokep Japanese Extreme teen fisting by a perverted old man
2215	Bokep Streaming Cum in my mouth SlowMo spit destroy make-up
2216	Bokep VictoryChannel: ZhannaKurtz
2217	Bokep Korean HunterUpskirts.com plump blonde upskirt
2218	Bokep Korean Horny 3D Big Tits Animated Teen Bathroom Hardsex
2219	Download Bokep Hot PAWG booty oil and ass spreading
2220	Bokep Jepang Sperm-Traudl is used hard for an insemination l…
2221	Video Bokep Hot Cougar Brooke Tyler Finishes BBC
2222	Gudang Video Bokep Lara West Suck Rim Swallow
2223	Video Bokep Hot Please Take My Wife
2224	Bokep Indo Showing to you every sm of my body playing with…
2225	Bokep 3gp Karma Rx TEEN PORNSTAR at home fucking herself …
2226	Gudang Video Bokep Streaming Richelle Ryan Ass Worship and Femdom
2227	Bokep Online LUBED – Sluts Jada Stevens and Crystal Rae nast…
2228	Bokep JULIET UNCENSORED GETS A CUMSHOT TO THE FACE @ …
2229	Bokep 3gp SarithaBrown sexy webcam model
2230	Bokep Indo Pornstar Poosoo fresh fuck
2231	Bokep Sucking Big Hidden Mother in Law 1
2232	Download Video Bokep Cougar Brooke Tyler Finishes BBC
2233	Bokep 3gp Lara West Suck Rim Swallow
2234	Video Bokep Hot Please Take My Wife
2235	Video Bokep Hot Showing to you every sm of my body playing with…
2236	Bokep Korean Karma Rx TEEN PORNSTAR at home fucking herself …
2237	Bokep Porno Richelle Ryan Ass Worship and Femdom
2238	Bokep 3gp LUBED – Sluts Jada Stevens and Crystal Rae nast…
2239	Bokep Online JULIET UNCENSORED GETS A CUMSHOT TO THE FACE @ …
2240	Bokep Streaming SarithaBrown sexy webcam model
2241	Bokep Pornstar Poosoo fresh fuck
2242	Bokep Japanese Desi Pari Indian Bhabhi Live Cam Sex
2243	Bokep Online Asa Akira plays with herself
2244	Bokep Indo Naughty Girl In Dress Riding Dick Doggystyle Ha…
2245	Bokep Sucking Big xhamster.com 4458044 sweet not mother uncensored
2246	Bokep Indo Pornstar Tease – Bobbi Dylan strip down and sho…
2247	Bokep Sucking Big Cristal is Rio Eye Candy
2248	Bokep Korean tell her name
2249	Bokep Porno Arte dibujos
2250	Download Bokep Blonde teenfuck
2251	Bokep Sex IUP Slut Kara Taylor gets her ass drilled by a …
2252	Bokep Japanese THE MOST HUMILIATED CUCKOLD SLAVE EVER!
2253	Download Bokep Streaming Casada dando surra de buceta e cu no marido
2254	Bokep Online Cam Girl Compilation – Geile Schlampen kommen a…
2255	Bokep Streaming Redhead eats wolfcock in dirtbar show-Dildo fuc…
2256	Bokep Porno Anal training of Lili Lamour
2257	Gratis Bokep Liz Vicious Star Trek
2258	Bokep Sex Chastity Slave – Teaser Clip
2259	Nonton Video Bokep Streaming Hot Employer Nina Kayy Is Banged By A Big Dick …
2260	Bokep Indo My Brother’s Pheromone Cologne
2261	Bokep Jepang My Movie8
2262	Bokep Hot AmateurTeen Gives First Footjob Only for Fu…
2263	Bokep Japanese HD Donald Trump watches Thai teen Heather Deep …
2264	Bokep Online Mofos – Dont Break Me – Petite Asian Stuffed wi…
2265	Bokep Jepang Derrick bangs out 2 hotties
2266	Download Bokep Streaming Colorful trailer
2267	Bokep Korean WwW.devilsophie.com The sexy whore cop who catc…
2268	Bokep Sex RealityKings – First Time Auditions – Licking Baz
2269	Bokep Jepang Susie masturbating in front of Sade Mare
2270	Bokep Sucking Big Lexi Dona – Watch my hot and horny lesbian play…
2271	Bokep Japanese Pussyrubbed lesbian babe squirts twice
2272	Bokep Streaming BLACK MASSEUR FUCKS WHITE WIFE IN FRONT OF HER …
2273	Gudang Video Bokep Let me tease you in my super tight skinny jeans
2274	Download Video Bokep Hermana fudendo com o namorado – www.xvideosnov…
2275	Nonton Video Bokep Streaming My First ANAL in Outdoor
2276	Gudang Video Bokep ELACASADA MAIS UMA NO RABO
2277	Bokep Indo Thickie Thick Wet & Geeky
2278	Download Video Bokep White babe anal banged by a real big black cock!
2279	Download Bokep Onyx Muse is a sexy brunette
2280	Bokep Porno My Amateur Girlfriend’s Horny Pussy Excites My …
2281	Video Bokep Hot PAWG squeezes dildo with big bootycheeks
2282	Video Bokep Online Blonde girls bound and whipped
2283	Bokep Meine Freundin und ich 1
2284	Bokep Jepang OldNannY Two Busty Meaty Lesbian Milfs Playing
2285	Bokep BDSM sub tiedup for pussy fucking with dildo
2286	Bokep Streaming KM.17.1 Kelsi Monroe Run From Police Part 1 Kel…
