	0
918	Download Bokep Streaming Jean Slayer doggy fuck Riley Maes tight pussy
919	Video Bokep best young pornstar cum over me and inside me p…
920	Bokep Online Getting sucked by my gf
921	Gratis Bokep sex and cum for hey people ADR00091
922	Bokep Streaming Indian Bhai ki Behen Busy
923	Nonton Video Bokep IBUKI has a hard anal sex with the French teacher
924	Nonton Video Bokep Czech Babe Anabel at Dirty photographer has sex…
925	Bokep Porno sexydea151012-083121-0
926	Bokep Streaming HDC1112
927	Gudang Video Bokep Blowjob and doggystyle
928	Video Bokep Korean Feet,JOI-Get CAMS of girls like this on FOOT-FE…
929	Nonton Video Bokep Streaming Claudia Smith LOVE Real Dick
930	Gudang Video Bokep Streaming Gaping and Squirting For You
931	Bokep 3gp Big white cock meets big Thai titties
932	Bokep Sucking Big beautiful brunette uses dildo on cam – xFuck.pro
933	Download Video Bokep Who is this girl?
934	Gudang Video Bokep Streaming LAPANTERRANEGRA
935	Nonton Video Bokep Czech Stunning Cheating Milf
936	Bokep Indo Ticklish Stocking Toes (Part 1)
937	Gudang Video Bokep Sammie Six get her butthole fuck so hard
938	Bokep Online Lily On Back Jiggle Show 1080p full video
939	Video Bokep Korean Hot cutie Inna showing her perfect ass and mois…
940	Bokep Sucking Big Selma Sins fucking wearing red fishnet stockings
941	Download Video Bokep Blonde Sweety Marsha May Fucks With Stepfather
942	Bokep Indo Mandingo and Piper!
943	Bokep Streaming Horny wife sucks cock and takes cumshot to the …
944	Bokep slave serving a Couple – 4
945	Gratis Bokep Cute redhead teen Renata Fox anal POV & DP
946	Bokep Streaming Sofia Cucci is my dirty squirting Doctor
947	Bokep Porno Forced to orgasm
948	Bokep Jepang Interview avec une ado de 18 ans avec de gros s…
949	Bokep Korean Panama Debut lonebanger
950	Bokep Japanese Ma soeur veut me baiser
951	Bokep Korean Sexy Nicole makes herself cum all over her desk
952	Bokep 3gp Amateur Anal: Free Anal HD Porn VideoxHamster m…
953	Bokep Sex LiamsSociety Verification Video
954	Bokep Bionda si masturba forte in web – rockvideoz.it
955	Nonton Video Bokep Nilou Achtland-Anal Screams Of Pleasure #1
956	Bokep Streaming PervCity Anal Threesome Phoenix Marie and Asian…
957	Bokep 3gp Busty dominatrix pegging sub deeply
958	Bokep Sex Assjob Therapy
959	Bokep Porno Elsa Jean gets woken up for a creampie
960	Bokep Brunette wifey plays plus a sex toy
961	Bokep Porno nice brunette fucked by a doctor
962	Bokep Indo master use and fuck her slut
963	Bokep Korean Amateur guy sucked and fucked by red light hooker
964	Video Bokep Korean Sexy eighteen year old cutie gets fucked hard
965	Bokep Indo 2 Blonde CamGirls
966	Bokep Sucking Big bam.17.04.18.a.sparkling.golden.shower
967	Bokep 3gp OLD VIDEO: 2015 Amy’s Bounce Test
968	Bokep Jepang Gang bang of a brutalized poor lonely girl! Vol. 2
969	Bokep Streaming Yanks Wiley Smiles Rips Her Stockings
970	Bokep Sex Blowjob Moms friend hidden cams amateur Reallif…
971	Download Video Bokep Sexy Sunny Lane Cowgirl Tease
972	Bokep Online sabtabhabhi rough sex
973	Download Bokep Streaming PornGoesPro – Watch big booty Austin Taylor fuc…
974	Bokep Milfona con belle tette scopata da cazzo italiano
975	Bokep Indo Sexy blonde girl fingering her pussy and cum wi…
976	Gratis Bokep Black guy fucks two huge tits MILFs
977	Bokep MILFSEXYCAM.COM-Sexy Stepmom Webcam Porn Video
978	Gudang Video Bokep sexy dominatrix shoes and stockings showing her…
979	Bokep Sex Melissa Candy on a sea coast show off her pussy…
980	Bokep 3gp EL chillin with homie we back at it
981	Bokep Korean StarrDecember and Lance McCurry in Amateur Porn…
982	Bokep Streaming super hot leaked girlfriend amateur homevideo
983	Bokep i love anal
984	Bokep Streaming Russian babe Ani Blackfox got her pussy fucked …
985	Bokep Japanese Horny little Redhead LittleRedPanty dry humps a…
986	Gratis Bokep Streaming – www.24camgirl.com
987	Download Video Bokep Beautys face is filled with males sticky glazed
988	Download Bokep I Shake My Ass For You Baby
989	Bokep Porno British Sonia lets one of her biggest fans fuck…
990	Bokep Porno Gmeen Mini Compilation
991	Bokep Sex Logan Pierce fucks a cute girl
992	Bokep Porno Milf JessRyan Streamate Gold Shows For Dummies
993	Bokep 3gp BBW Secret Voyeur Taping
994	Download Bokep Daughter and daddy spend time together dicknast…
995	Bokep Tiff Banister Gets Drilled By BBC
996	Bokep Porno Fucked a whore in Strip Club!! Cummed in mouth
997	Bokep Korean Die sekretärin 4 Teil 1
998	Bokep Indo Masturbation and butt plug
999	Bokep Japanese Alyssia In Black Stockings
1000	Bokep Jepang La Reina del Porno chileno squirt con longaniza
1001	Bokep Porno VID-20170717-WA0001
1002	Bokep Japanese My tight pussy wrapped around a beautiful cock
1003	Nonton Video Bokep Anal fuck of Sid And NancyXX
1004	Bokep Online SANJANAMASSAGEHOT-1
1005	Bokep Korean capturedvideo.MOV
1006	Video Bokep Sex KatrinaBooty-HungLo-buddhabang
1007	Bokep Indo 20170128 020214
1008	Bokep Indo rel amateur couple with livecams for the voyeurs
1009	Video Bokep TOUR OF BOOTY – Arab Women Are Rounded Up By Am…
1010	Bokep Sex Hipster lesbians have hipster sex in their bedroom
1011	Bokep Six Litre Syringe Challenge – The Next Two Litres
1012	Bokep Porno Brunette babe is sprayed with cum
1013	Bokep Streaming quinta Recopilacion 8 escenas 2016 a 2017 sexo …
1014	Bokep Porno SPH Cucky
1015	Bokep 3gp All Natural Kimber Lee & BBW Angelina Castro Do…
1016	Nonton Video Bokep 18auditions.com – Comp #3 – Teens Creampie in t…
1017	Download Bokep Streaming Hear Rusty cum
1018	Gudang Video Bokep Streaming MOST Extreme Angel Perversion Part #1 – Angel S…
1019	Bokep 3gp Horny Vampire babe masturbates for slave boy
1020	Bokep Chrissy se dedea en Omegle
1021	Gratis Bokep Streaming sexy young teen
1022	Bokep dildo Cam Whores
1023	Bokep Porno You get to fuck the slutty Zoey Foxx
1024	Bokep Online Muslim Wife Homemade Sex Tape
1025	Gratis Bokep Briana Lee Member Show May 27th 2015
1026	Bokep Streaming Penelope Black Diamond – Milking Tits – breastf…
1027	Gratis Bokep Streaming Pink pussy masturbate.
1028	Nonton Video Bokep Streaming White chick quick ass and pussy flash
1029	Bokep Sucking Big playin with my ass bein silly
1030	Bokep Streaming Busty babe Katarina Kozy ride on dildo
1031	Bokep Sex Anisyia on high heels plays with two vibrators
1032	Bokep Indo Kirsten Price lesbian fun
1033	Bokep Jepang Reboot new email I was fresh out and on a mission
1034	Download Bokep Streaming Young Allen Benz anal and cum in mouth
1035	Bokep Streaming savita bhabhi fuked by monu 10000 ma rough
1036	Bokep Online Strapped fellow smothered by a couple of coarse…
1037	Bokep Porno La Seriexxxx
1038	Bokep Korean Hot Lesbo Lesbians Playing After Yoga Session
1039	Bokep Indo Yuno Corners You and Drains Your Cum preview
1040	Bokep Japanese 24year old 36ff girlfriend sucking dick in the …
1041	Bokep Sex LESBIAN BONDAGE: Sensual PUSSY Tease – Maria Jade
1042	Download Video Bokep Alpha Male
1043	Download Video Bokep BLACKEDRAW Classy hot wife destroyed by bbc
1044	Download Video Bokep BANGBROS – Audrey Bitoni Secretly Fucking The M…
1045	Bokep Online Mofos – Milfs Like It Black – Big Ass Maid star…
1046	Bokep Indo BLACK4K. Repair me!
1047	Bokep Online IMG 0131 (1).MOV
1048	Bokep Porno RealityKings – CFNM Secret – (Amy Anderssen) CF…
1049	Bokep Online MVI 5468[1]
1050	Bokep Jepang Biggest Tities http://kurtporn.com
1051	Bokep Online Amile Waters GoodBlowjob-BubblebuttBarbeque2
1052	Bokep Korean POV Ebony Babe Anal Creampie with Big Hard Whit…
1053	Gudang Video Bokep Streaming Teen masseuse gobbles for cum
1054	Bokep Sucking Big SHE HAS TO HAVE BBC
1055	Bokep Sucking Big Cute, skinny teen have fun with ohmibod in puss…
1056	Video Bokep Sex Netflix and Chill
1057	Bokep Korean Son Transforms Mom into His Own Personal Whore …
1058	Bokep Streaming Dominant Summer Bailey Passes Stinky Farts on S…
1059	Gratis Bokep Streaming Skyrim Immersive Porn Episode 2
1060	Bokep Sex Kira Queen teasing and having sex with Teddy be…
1061	Gudang Video Bokep Big Tits Teen learns to Fuck in Casting Threesome
1062	Bokep Streaming Golden shower on the face of bbw, lesbian girlf…
1063	Gudang Video Bokep The Kiera Lord Experience
1064	Video Bokep Hot Natalie Buchanan gets down
1065	Video Bokep Sex Horny Agent Mea Melone Advices a Newcomer
1066	Bokep Sucking Big 480P 600K 95625051
1067	Video Bokep Husband and Machine Spit Roast Filthy Wife
1068	Gudang Video Bokep Streaming defence (1)
1069	Bokep Korean Sissy Hypno Training
1070	Bokep Jepang Jade Chan and the Red Lingerie
1071	Gudang Video Bokep Streaming Jennifer White Needs Cock in Her Ass
1072	Bokep Indo INTERRACIAL CUCKOLDING IS BEAUTIFUL
1073	Video Bokep Online Busty Black Anal Slut Creampied By Monstercock …
1074	Bokep Jepang Esmeralda Eston sucks a large cock
1075	Bokep Porno 20180324 232622
1076	Nonton Video Bokep Streaming Orally Ypurs Preview
1077	Bokep Streaming Mom Made Me Impregnate Aunt Dee Williams
1078	Bokep Indo Wicked babe is riding on teacher’s hard ramrod …
1079	Download Bokep Streaming Make that phat ass booty bounce back
1080	Bokep Porno Pregnant Marie fucking
1081	Bokep Hot pornstar ass banged
1082	Bokep 3gp HORRORPORN – Hell in Jail
1083	Bokep Sucking Big Sexy Cheating milf throats neighbor big dick th…
1084	Gudang Video Bokep Streaming Sofia Cucci is a hot Santa Claus playing with a…
1085	Bokep Japanese fem dom full legth
1086	Bokep Online Adolecente rubia
1087	Download Bokep Streaming meth head slut pounds pussy with large dildo wh…
1088	Bokep Korean Grandma fulfills her darkest fantasy
1089	Download Bokep Teen slut makes herself cum
1090	Bokep Jepang 40,000 Years of Anal Tears (Jessica Kay)
1091	Bokep Streaming liza gangbagnged
1092	Bokep Indo Pretty blonde Alix Lynx gets a load on her tits
1093	Video Bokep Sex Briana Banks Loves Jenna Jameson
1094	Bokep Sex Candy Camilly Exotic Big Ass Pornstar Fucks a F…
1095	Video Bokep my sleeping sister cum on her soft feet sole ca…
1096	Bokep Porno video:5492
1097	Bokep 3gp Creampie for Pregnant Pussy
1098	Bokep Indo PervCity Young Anal Threesome
1099	Video Bokep Facebook Hook Up
1100	Video Bokep Hot Teen open her pussy wearing fishnet stocking an…
1101	Bokep 3gp Big black cock 11 inch extender
1102	Bokep 3gp zelda takes two cocks squirting anal and suckin…
1103	Download Video Bokep Niki Gold hires a new cleaning lady
1104	Bokep Indo Smashmaster on a mission hitting Wonna in the M…
1105	Bokep Sex Hard nipple caning for big titted woman
1106	Bokep 3gp video-2014-06-14-03-28-49
1107	Bokep Japanese Fucking myself in the public restroom,Vancouver…
1108	Bokep Jepang Best blowjob
1109	Gudang Video Bokep Streaming Purple & Pink Sunny Lane Uses 2 Vibrators To Po…
1110	Bokep Indo Liveshow ErosPorto con Mary Rider, Luna Dark e …
1111	Nonton Video Bokep Katy karson gets fucked and her ass ate
1112	Gratis Bokep 20170423 002459
1113	Bokep 3gp Huge Tit Play at Vixenhub.com
1114	Bokep Streaming Two Gorgeous Girls Feet Worship Fetish
1115	Download Bokep ❤Kalisa❤
1116	Download Bokep Streaming Horny slave for sexy mistress SpicyHoneyMilf
1117	Bokep Streaming Mature Asian slut gets toyed and she sucks it
1118	Bokep Porno Spectacular Hot Sex At The Living Room!
1119	Bokep 3gp Amateur Catybluee Masturbating On Live Webcam -…
1120	Bokep Porno I love to showcase my moans… Pounding myself …
1121	Bokep Sucking husbands dick while he’s cumming on me
1122	Nonton Video Bokep POV fuck session with Elsa Jean & Derrick Pierce
1123	Download Video Bokep UK babe facialized while sucking two dicks
1124	Bokep Porno Good 69
1125	Bokep 3gp hentai hypersex small petite girl so horny
1126	Bokep Japanese Tease please
1127	Bokep Porno Selfie Bitch
1128	Bokep 3gp Home fuck and cum on my ass with Vira Gold
1129	Bokep Jepang Amateur Whore riding cock
1130	Bokep Indo SpankBang miravideo mofos 9 abby lee 480p
1131	Bokep Step Dad Said Mom Suck Dick Better Then Me, So …
1132	Bokep Indo Lauren, My Whore Roommate, on College Rules (cr…
1133	Bokep Sucking Big Strong fuck for perky tits Japan doll Airi Sasa…
1134	Bokep Sucking Big Maid Milena Davi sucks and fucks
1135	Bokep Indo Russian sweetie playing with toys on teenwebcams
1136	Bokep Porno Devon Breeze And Lucy Lane Threesome Action
1137	Gudang Video Bokep Mamando
1138	Bokep Korean Co-worker
1139	Bokep Japanese trim.750FFF9B-0945-488E-B264-2DB630844DE6.MOV
1140	Download Bokep Streaming The best of fesses[1]
1141	Bokep Korean 027 kate kneeling tiptoeing promo
1142	Video Bokep Hubby filming boyfriend fucking me
1143	Bokep Jepang Acrobatic honey shows real talent at her fuckin…
1144	Bokep Jepang FMD 0817 01
1145	Bokep Korean Tiny tits brunette babe uses a toy
1146	Bokep 3gp Fucking yourdesire
1147	Bokep Online The body was also beautiful and slender
1148	Video Bokep Maria Jade Mind Control Handjob – KyleChaosFeti…
1149	Bokep Sex Healing in the woods with erotic energy – BAREM…
1150	Bokep Online Ass and sexy feet
1151	Bokep Indo PUBLIC BEACH SEX – WE ALMOST GOT CAUGHT!! – Lia…
1152	Download Video Bokep Try to hold your cumming, impossible! I know!
1153	Bokep Japanese Piss and fuck hard in the shower
1154	Bokep Sex vídeo106
1155	Bokep Sucking Big ViTuongNguyen20171009
1156	Bokep Streaming BlackxRose92.com Preview
1157	Video Bokep Japanese Tarra White – Anal Perversions Compilation PMV
1158	Download Bokep Streaming gf does the moneyshot
1159	Bokep Streaming Trailer
1160	Gratis Bokep Cum in mouth. Rebecca Rainbow and Vira Gold
1161	Video Bokep Korean Abigail Mac has roughly good lesbian fun Lily E…
1162	Bokep Streaming Bigtits brunette masturbate in her chair
1163	Download Video Bokep Teaser Dixie-malone-mate-Johanna-white-castee-p…
1164	Bokep Real cuties fuck for sperm
1165	Bokep Porno Video 2
1166	Bokep Sucking Big FUCKNDRIVE.COM: Rainy Mood
1167	Bokep Hot lesbian babes fucking in shower
1168	Gudang Video Bokep Angela Kiss, the young maid ass-fucked
1169	Bokep Japanese Spanish Fetish Fever
1170	Bokep sexy Lexi Aaane goes solo and Plays with huge D…
1171	Bokep Online Here is Mia Khalifa’s sexy body up close… I h…
1172	Download Bokep Her Wet squirting Pussy cum dripping
1173	Bokep Sex cute chubby BBW Hayden Blue big butt spanking d…
1174	Bokep Indo Anal Fucking Rahyndee James POV Morning Sex
1175	Nonton Video Bokep Miss Melanie Livingston from Edinburgh pumping …
1176	Bokep Porno Busty Stacked Plumper Devyn Devine Swallows BWC
1177	Bokep Sex Training session 1
1178	Nonton Video Bokep Salma ass fucked & creampied GG224 (exclusive)
1179	Bokep Porno She Likes It with Annabel Harvey and Jack Moore
1180	Bokep Streaming Living Dead Girl – Sex Whit the Zombie
1181	Bokep Sex Lesbian Ass Licking 2 Part 1
1182	Bokep Streaming ConorCoxxx-POV handjob from your teacher Jessic…
1183	Bokep Streaming DE LICRA BLANCA Y DANDOME PLACER
1184	Download Video Bokep my sleeping sister cum on her soft feet sole ca…
1185	Bokep Jepang Việt nam em yêu gái chảy nước lồn lênh láng
1186	Gudang Video Bokep Streaming Alluring feet cutie jizzy
1187	Bokep Indo S3D Ep.5 Goddess Fucker
1188	Bokep Japanese Savana Styles loves Betty Page-Part 2
1189	Bokep Streaming Busty webcam model DevilSophie baths in Chocola…
1190	Bokep Porno shower with 9 months pregnant amateur MILF
1191	Bokep Indo xvideos.com 0e1d8bff9680f20c6d932567b83e1cab-1
1192	Download Video Bokep RealityKings – Happy Tugs – Asian masseuse jerk…
1193	Nonton Video Bokep Streaming Czech – Pussy licking fun with me and gorgeous …
1194	Bokep Porno Milking Her Cuck Daddy
1195	Video Bokep Hot Very pregnant girl PUBLIC threesome at a gas st…
1196	Bokep Jepang Caprices spanking by Mrs. Doctor.
1197	Bokep Indo xvideos.com bb9aca3a18cabb207dcb3f64a4be6296
1198	Gratis Bokep Streaming Teen babe sucks POV cock before riding it
1199	Bokep Indo Busty masseuse eats pussy
1200	Bokep Japanese pinQ wet Heels without Her Panty
1201	Gudang Video Bokep panties (WM) – c4s.com(slash)89232 NataliaAndAr…
1202	Gudang Video Bokep Foot Love Boat (Part 1)
1203	Download Video Bokep 20171106 182204
1204	Download Bokep Big tits, big lips, huge bush! – teencams.us
1205	Video Bokep Sex Fucked By The Boss-AB-trailer
1206	Bokep 3gp cum compilation
1207	Gudang Video Bokep Streaming British Babe Squirts All Over The Hotel Bed In …
1208	Bokep Japanese Skyrim Monster love
1209	Bokep Online TLBC – Tight Asian Teen Eva Yi Gets Fucked By S…
1210	Bokep Sex 07-12-11 0926
1211	Download Video Bokep PervCity Anal Threesome Overdose Alana Evans, T…
1212	Bokep Online Busty Bex instruction how you can fuck her tits
1213	Bokep Korean Danika Mori White girl finishing him up
1214	Download Bokep Streaming Stuffin Good Rockman
1215	Gudang Video Bokep Streaming busty asian 18yo fucked on table and facial
1216	Bokep Sex PussySquirt
1217	Video Bokep Japanese videoWithLogo1506974976428
1218	Bokep 3gp Jexaut2018 playing my small tits
1219	Bokep 3gp Lana Rhoades big tits redhead girl play in fron…
1220	Bokep Sex White Leggings Facesitting with Nikki Brooks
1221	Gratis Bokep private moment become a mess
1222	Bokep Online 3 Girls Sucking and Licking Big Black Butt and …
1223	Download Bokep Streaming Mi ex caliente de 18 años muestra los senos y s…
1224	Bokep Online My Return TouchDown
1225	Bokep Micro Mini Thong Booty Clapping
1226	Bokep 3gp Slideshow: Angel and Ulf Larsen – 38 years apart
1227	Bokep 3gp Goth girl real orgasm with big cock
1228	Download Bokep Sofia Cucci loves Priscilla Salerno
1229	Bokep Porno Jugando con mi amiga
1230	Nonton Video Bokep 20161013 184034
1231	Bokep Online Legs open to everybody! Italian Amateur Orgy!
1232	Video Bokep Korean Kimber Lee & Ashlynn Taylor Do BJ & Get Butt Cr…
1233	Gudang Video Bokep ILoveSuckingMyBFsBigCock v1a
1234	Download Bokep Streaming Vipissy – Shrima Chrissy – Piss Drinking Lesbians
1235	Bokep Sex Intimate Lesbians – Jessica Jaymes and Sea J Ra…
1236	Download Bokep Streaming BUSTYUSA-2051
1237	Video Bokep Kinky dyke babes strapon fucking in luscious th…
1238	Bokep Porno BootyDude
1239	Gudang Video Bokep Rusty spitroasted
1240	Bokep 3gp Stunning Aussie Teen Need A Cock
1241	Bokep Sucking Big BANGBROS – Behind The Scenes with Pornstar and …
1242	Download Bokep MAMADA EN EL COCHE/BLOWJOB IN THE CAR
1243	Bokep Japanese Lynygelo Masturbando a mi Gelo para enviarle a …
1244	Bokep Korean HOT TEEN POV BLOWJOB How quick can I make you cum
1245	Bokep Porno 20170517 000156
1246	Video Bokep Japanese a wet fat pussy
1247	Bokep Japanese Hot girl and big dick soldier
1248	Bokep Streaming CS – Bigtitts Show Preview
1249	Gratis Bokep french chloe
1250	Bokep Sucking Big Wild Office Party with Sluts
1251	Download Bokep Amateur Couple Fucking naughty nasty free porn …
1252	Bokep Porno Jeccabird – Toy Tease
1253	Bokep Streaming Solo masturbation with Kitty Purrz
1254	Bokep Boyfriend With Morning Wood Needs Pussy!
1255	Video Bokep Sex stroking my cock compilation 1
1256	Bokep Indo Busty Jelen Jensen Gets Nude Outside!
1257	Bokep Streaming Sex appeal honey is having great banging with h…
1258	Gratis Bokep Streaming Dad Is Boring
1259	Video Bokep Jute bondage hard tied chest in grey body with …
1260	Nonton Video Bokep camsex 129
1261	Download Bokep Camgirl Jany Riding Dildo – 24camgirl.com
1262	Download Video Bokep Blonde Thai Girl Sucking Cock
1263	Bokep Streaming Hentaikuindo.Trade 63151a8a1880a77404db7de54160…
1264	Gratis Bokep Stepdad at Poolside fucked the young stepdaught…
1265	Video Bokep Hot booty hot mature mom invites not her son for a …
1266	Download Bokep Longue Long Tongue Mouth Fetish Lollipop FULL V…
1267	Bokep Anal Hotel – Ass Hole Cum
1268	Bokep Korean Nuestro primer video
1269	Bokep Japanese Hot bartender sucks a cock in her bar
1270	Bokep 3gp 1160349
1271	Bokep Korean Julie and Kim Love Choking Each Other
1272	Download Bokep Streaming Sexy young Lucie showing her big tits
1273	Bokep Porno King Noire & Lethal Lipps: BDSM on The Balcony
1274	Bokep fucked my friends mom after I found her on toho…
1275	Video Bokep Japanese Lesbian Hoes
1276	Gudang Video Bokep Step sister and her step brother shower sex Rea…
1277	Gudang Video Bokep Streaming Chubby Ebony Squirts All Over The Sofa
1278	Gratis Bokep Streaming Hot Blonde Czech Girl Gets Fucked Hard For Not …
1279	Bokep Online HCVAR0334-2
1280	Bokep Passionate pussy-ramming takes put in front of …
1281	Nonton Video Bokep Streaming Suzie sweet
1282	Video Bokep Hot Beautiful masseuse gives ass massage – Aspen Ra…
1283	Bokep Porno Zurieelivira
1284	Bokep 3gp Sex insane amateur tape themselves having a hot…
1285	Bokep Jepang Teen Uses a Fuck Machine on her Smooth Pussy
1286	Bokep 3gp Post this
1287	Nonton Video Bokep https://g1hentais.com – Tensei Kendo no Harem C…
1288	Download Bokep Streaming Morena na siririca no Omegle
1289	Bokep Porno Prostate Massage Sasha Grey-http://pornspecial….
1290	Bokep Sex Chrissy Fox has 3some
1291	Bokep Porno Two Female Agents in front of Amateur Jerker
1292	Bokep Porno Award Winning Sunny Lane In Sex Crazy 11 PornSt…
1293	Bokep 3gp Attend a Porn Party Film In Person with Riley R…
1294	Bokep Streaming Adelis Shaman foot fetish stroking his legs
1295	Bokep Sex DSCN6132.MOV
1296	Bokep Online Desire For Sex
1297	Bokep Vayana getting fucked by the shore in a threesome
1298	Bokep Streaming British angel Clare Margarson whips up some cre…
1299	Bokep Indo Gorgeous busty blonde Alanah Rae fucked hard
1300	Bokep 3gp found this cute teen at meetxx.com and we fucke…
1301	Bokep Japanese Legion Holk – Abi Martinez
1302	Bokep Japanese Her first face fuck and intro into the sub and …
1303	Bokep Sex kinky girl in cybersex
1304	Bokep Sex Latex Lucy Dominates Blue Angle As They Fetish …
1305	Bokep 3gp Nude Fight Club backstage with Playful Ann & De…
1306	Bokep Streaming Xuất tinh vào lồn vợ
1307	Bokep Japanese Sofie Marie and Rome Major cuckhold and breed
1308	Bokep Porno Thick girl gives PAWG ass worship in thong and …
1309	Bokep BIG GIRLZ GONE WILD LOVE TO THE FANS 2018
1310	Bokep Streaming Asian Maid Makes Her Wimp Client Kiss Her Ass -…
1311	Bokep Korean Regina Blue Hot Teen Fuck In Megacasting
1312	Gratis Bokep 20161025 054433
1313	Bokep Online melodykush (21-08-2015) 01:07:39 xxx2.us
1314	Bokep Japanese IMG 00331
1315	Bokep ihc54
1316	Video Bokep Online 3D Comic: Hotwife Cuckolds Husband With Persona…
1317	Bokep Streaming Nasty Asian Freak Angelina Chung Gets Fucked Hard
1318	Download Bokep Proper examination of her sweet young cum-hole …
1319	Bokep Fitness hot girl taking a shower – sexy BRAZILIAN
1320	Bokep Porno jill gets fucked
1321	Video Bokep Wife Cibelle Mancinni e sua Prima Lavando o Carro do…
1322	Gudang Video Bokep Natalia z flirt-24.pl robi sobie dobrze
1323	Bokep Tantalizing Dick Sucking Chick
1324	Bokep Porno Gutter Teens (dreckigeteenies)
1325	Gratis Bokep Streaming Amateur fucking her first anal!
1326	Bokep Sex interracial amateur party
1327	Bokep Korean Asian BDSM With Bound Japanese And Oriental Mas…
1328	Bokep Indo TT62 carmen calloway 6m
1329	Gratis Bokep freecamnow.tw.ma – arabian girl get fucked by b…
1330	Bokep Japanese 1473988
1331	Video Bokep Sex Appetizing chubby shaves his big hairy pussy, a…
1332	Download Bokep BTS
1333	Bokep 3gp cum and anal
1334	Bokep Indo SidAndNancyX webcam fuck deepthroat anal
1335	Bokep Sucking Big Hotwife, (Aimazing) gets filled up and has mass…
1336	Bokep Porno rosalatina hot recording from her cell phone
1337	Download Video Bokep BIG NATURAL BOOBS
1338	Bokep Sucking Big Sucking that pussy good
1339	Gudang Video Bokep Cgirl420 masturbating with 2 vib and white pant…
1340	Nonton Video Bokep Cheating wife Bridgette B blows a guy then fuck…
1341	Bokep Sex Milk on her hairy pussy
1342	Bokep Japanese Crazy Pussy for a young Cock!!! #1–1246
1343	Bokep Sucking Big Teen whore Silvia Dellai enjoys 4on1 Interracia…
1344	Bokep Sucking Big Skinny busty babe ElaySmith with pierced nipple…
1345	Bokep Streaming Sofia Cucci in white sexy lingerie cums on the …
1346	Bokep Korean Hot wife Nicole eating cum from plenty of guys
1347	Bokep Jepang Big black ass riding
1348	Bokep Streaming BANGBROS – Sliping and Sliding with Busty Stepm…
1349	Bokep Sucking dick in the car leads to hard fucking c…
1350	Bokep Streaming SEX WITH THE EX – HOMEMADE FORCED BI CUCKOLD
1351	Bokep Japanese Fucking My BF best friend
1352	Bokep 3gp Masturbada rico
1353	Bokep Online I am pee a lot times on all furniture and trash…
1354	Download Video Bokep Tattooed aussie fucked on bed with legs spread …
1355	Bokep Streaming gozando e gemendo, pedindo PICA no cú
1356	Bokep Indo Little Red Ass Riding Hood gets Spanked and Ana…
1357	Bokep Streaming Amateur teen camgirl in glasses dildoing on webcam
1358	Download Bokep Streaming skinny fit flexing
1359	Gratis Bokep Streaming Cum inside of her
1360	Bokep Sucking Big micky bells bra show
1361	Bokep Online Kinky Ass Training
1362	Bokep 3gp Ellen Betsy & Julia Red swaps sperm after hardc…
1363	Bokep Jepang Tracy Adams fucking Ron Jeremy’s big cock in a …
1364	Bokep Porno (Anastasia Morna) – The Worlds Smallest Tuxedo …
1365	Bokep Online Tied And Fucked In Ballet High Heels – JoCoBo
1366	Bokep Japanese Brunette puts her panties in the pussy
1367	Video Bokep Reallifecam Voyeur – 69 Oral Action With Young …
1368	Gudang Video Bokep Streaming amateur young skinny wife fucks and sucks cock …
1369	Bokep Streaming Pretty brunette babe screwed in a ranch
1370	Bokep Porno No one knows why lesbian love anal but they do …
1371	Bokep Porno Hot indian Girl and aunty anal pussy ki chudai …
1372	Bokep Online Stunning Kitty Purrz
1373	Gratis Bokep Dirty C in xxdark
1374	Gudang Video Bokep DON’T FUCK MY DAUGHTER – Teen Lexie Banderas Ge…
1375	Gudang Video Bokep Marialbeauty – 21.03.2018 Queenvids.com
1376	Bokep Korean ASS STRETCH
1377	Bokep Sucking Big Milena Santos good experience
