	0
454	Download Bokep amanda blunt fucking both holes big ass pawg
455	Gratis Bokep Risky Work Blowjob
456	Bokep Indo Busty Blonde Showing Her Big Breasts
457	Bokep Online MILF Solo Bedroom Pussy Play -Chattercams.net
458	Nonton Video Bokep Twitter Superhead @Swoonettexxx Dick Sucking Li…
459	Bokep Porno Pegging Glory Hole
460	Bokep Porno Sexy strip dance for daddy by DevilSophie
461	Bokep 3gp MELINDA HUNGARIAN SLUT GETS HER CUNT SLAPPED
462	Bokep Jepang Daisy Monroe POV BJ
463	Download Video Bokep Unexpected visitor Jillian Janson
464	Bokep 3gp gai dep choi ngon
465	Video Bokep Wife Sunny Blonde Teen’s First Porn Audition!
466	Gratis Bokep Streaming 20180101 231959
467	Gratis Bokep PHILAVISE-Aussie mom Yasmin Scott gets interrup…
468	Bokep Porno College Cock Sucking Race
469	Bokep Porno Gabriella Enslaves Her Boss – Gabriella Paltrov…
470	Bokep 3gp Family holiday…your first sex experience with…
471	Download Bokep Deshi blond priyamani cam sex
472	Bokep Jepang Hot fat girl shows off big tits and huge BBW as…
473	Bokep Sex Husband Catches His Wife Cheating And Joins The…
474	Bokep Korean Busty Buffy ass fucked with huge toy
475	Download Video Bokep Fukin Ms JuicyFruit 001 001
476	Bokep Sex Desi scandal compilation
477	Nonton Video Bokep Streaming Big tits
478	Bokep Online Pornstar Poosoo in full mood
479	Download Video Bokep Lil squirt gives husband blowjob
480	Download Bokep Streaming Big boobs Sexy girl in front of camera More vid…
481	Bokep Deep Arab Fuck
482	Bokep 3gp Orgy with 3 mature whores! Anal and Spittle!
483	Download Bokep Streaming 720P 1500K 94473801
484	Bokep Indo Nataly Gold – The Limp Slut
485	Bokep Streaming Trailer teen Masturbate On The Beach X
486	Gratis Bokep Streaming Strapon clad mistresses
487	Bokep Indo AGENTE SEXY DO FBI
488	Gratis Bokep Cocksucking amateur euroteen losing the game
489	Gudang Video Bokep Streaming Teen slut Elsa Jean gets her big pussy fucked hard
490	Bokep Porno Dutch bbwclit rub
491	Bokep Japanese panties-good-bad-girly
492	Bokep Sex VID-20171025-WA0003
493	Bokep Online Teens Beautiful Thighs Are Cum-painted
494	Gudang Video Bokep Morning Wood Jerk and Cum Shot
495	Bokep Nice teen bound to a pole then caned
496	Download Video Bokep Fat Ass booty in the store
497	Bokep Hot Slut Chubby Girl Fucked By Old Man
498	Download Bokep Gina Gerson and Valentina Bianco lesbian sex
499	Bokep Indo Lexidona – Free Time – Pornstar
500	Bokep Sex webcam girl hottalicia gives a blow-job and get…
501	Bokep Online VRpussyVision.com – Old MILF Lesbian licking an…
502	Download Bokep clip ki niem nguoi yeu cu
503	Video Bokep Korean making my ass clap
504	Bokep Sucking Big Torturing me with my favorite toy… – Angelswa…
505	Bokep Streaming Amber key sucks sexy
506	Bokep Streaming Riding my dildo reverse cowgirl with anal plug,…
507	Bokep Hotwife Clea Gets Pounded By Huge Black Cock
508	Bokep Streaming VID 20170514 201017099
509	Download Video Bokep Forced a failed actress
510	Video Bokep Sex Dating links – http://JMPORN5.INFO — http…
511	Bokep 3gp Whore MILF Blackmailed
512	Nonton Video Bokep Streaming Cock Hungry Teen Gets Tits Sprayed With Goo
513	Bokep Sucking Big (Casa de cita clandestina ) Prosti se deja coje…
514	Gudang Video Bokep Streaming Suspension jute tied legs in lingerie
515	Bokep Streaming pool play NataliaAndArami part (5)c4s.com(sla…
516	Bokep 3gp Popular twitch model fucks uncle for her fans
517	Download Bokep Streaming doctora caliente y puta se coge al paciente
518	Bokep Jepang Bratty Sis – Step Family Threesome, Jasmine Gom…
519	Bokep Sucking Big American milf Vivi has lots of fun with her hai…
520	Bokep Porno 102 5732.MOV
521	Bokep Indo Chika in office suit uses vibrator
522	Bokep Spiked heels and big loads
523	Gratis Bokep 9 Guys Gangbang Black Teen From The Hood
524	Bokep Streaming FUCKING AND DEEPTHROATING HOT BLOND YOUNG CHICK…
525	Bokep Japanese Big load of dick disappears in hot babe
526	Video Bokep Online Lively 18 Year Old Tramp
527	Bokep Korean Tanzi takes a brutal ass fucking at anal therapy
528	Bokep Indo RealityKings – Street BlowJobs – Cum On Kimber
529	Bokep Sex Kitchen Sex!
530	Gudang Video Bokep The Sleepover – Part I
531	Bokep Japanese SON SLAMS HIS BIG TIT STEP MOM
532	Bokep 3gp all double penatration compilation
533	Gratis Bokep Charming darling arouses hunk with her wicked c…
534	Bokep Korean Fantasy party fuck for a clown couple
535	Gratis Bokep KEISHA GREY PERFECT ANAL FUCK TOY
536	Bokep Porno clapping
537	Bokep Japanese cute blonde sucking on webcam – more at www.unt…
538	Gudang Video Bokep Streaming Poppy Morgan Creampie in Ass
539	Gudang Video Bokep Streaming Public Sucking
540	Bokep Streaming monster cock for hot hot ASS!!!
541	Bokep Sucking Big SCREWBOX – Natalia Starr in “Beautiful Day”
542	Bokep Streaming PervCity Blonde Babe UpHerAssHole
543	Bokep lisalovesalot on cam on cock deep throating
544	Download Video Bokep Ghetto Lesbians
545	Bokep Porno Kinky lesbian babe gets vagina licked with a to…
546	Bokep Korean Carnal Booty Tramp
547	Bokep Japanese Sofia Cucci jerking off the cock of a group of men
548	Bokep Online Hot PAWG Dayne Vendatta
549	Bokep Sucking Big ANAL CUMMING
550	Gudang Video Bokep Stepfather get a blowjob from stepdaughter and …
551	Nonton Video Bokep Streaming Having Sex with Barmaid Japanese VR Porn
552	Bokep 3gp Crossfit Coach makes me Squirt More Part 2
553	Video Bokep Online GOFUCKAGIRL – Fucks Danco ass to mouth. Vira Go…
554	Bokep Streaming Creamy redbone
555	Video Bokep Hot cool girl on cam – hotcamgirls24.com
556	Bokep Online Voluptuous babe strokes a cock with her wet throat
557	Bokep Online Hot natural teen fucked by mexican mariachi!!
558	Download Bokep Novinha magrinha fode depois da siririca
559	Download Video Bokep Late-night backshots with my lady
560	Bokep Korean Sorority Sisters Teaching The Noob
561	Bokep Indo Super cute girl show cam – freesexcam.xyz
562	Bokep Porno THEPHATNESS.COM CINNAMON BROWN CREAMPIE
563	Bokep Porno Fitness Babe Squirts Creamy White Cum
564	Gudang Video Bokep hot babhi bathing scence
565	Bokep Streaming Big titty Hood freak RIDING UP! Ebony (jade)
566	Bokep Porno Mona bhabhi xxx pron
567	Nonton Video Bokep Liz Vicious Car Ride
568	Bokep Morgan Drinks Piss and Cum on the Patio
569	Video Bokep Japanese Lexidona – Shower Time – Home Made
570	Download Bokep Masturbating and playing with toys – add me on …
571	Nonton Video Bokep Assfucked glamour eurobabes jizzed on asshole
572	Bokep Porno masturbating girl nice tits
573	Bokep 3gp lady anabellaxxx1 squirt a lotttttttt
574	Video Bokep Korean German Amateur Threesome During Porn Casting – …
575	Bokep Japanese Leya Falcon Fucks Jayden Cole
576	Bokep Indo amazing ruff fuckerz
577	Bokep Fit milf striptease
578	Bokep Korean Naughty Play
579	Download Bokep Streaming Sensual lesbians Sybil and Alyssia Kent in scen…
580	Gudang Video Bokep Streaming swan220 sexy cam girl inserted a carrot in her …
581	Bokep Porno Paris Needs to Release
582	Gudang Video Bokep Streaming Gemma Minx superb solo video
583	Bokep Indo Teens face jizzed over
584	Bokep Sex Bukkake in cinema for 2 MILFs who love to share…
585	Gudang Video Bokep Streaming Monica Santhiago Amateur Nude Teasing
586	Download Bokep Stretching Her Asshole with a Butt Plug
587	Bokep Porno Nicole Graves Treat of The Month
588	Bokep Sucking Big Kati and Mel
589	Nonton Video Bokep Streaming bailando y moviendo el culo en medias de nylon …
590	Bokep Streaming Saturday soak with Squirtonme2014
591	Bokep Korean The babes cleaning and masturbate
592	Bokep Indo Tit Slapping Nipple Sucking Lesbians
593	Bokep Streaming Fishnet lingerie on a hot bodyshe is live at …
594	Bokep Indo Katie71 Pussy Spread Wide For YOU!!
595	Bokep Japanese Tracey Adams Compilation
596	Bokep Korean Busty Ava Addams Fucking
597	Bokep Online Big Cock for a Tight Teen
598	Bokep 3gp girl jeyssy69 playing on live webcam– 6cam.biz
599	Bokep Jepang Mr Plus 1: Cum Demon ft MissCaramelMinxxx
600	Bokep Online Jelena Jensen Masturbates at the Beach!
601	Video Bokep Korean The New Experience ( Furry / Yiff )
602	Bokep Japanese My Girlfriend Caught Me Masturbating And Then L…
603	Download Bokep Fisty upload 1
604	Bokep 3gp A tender teen with a beautiful body upload her …
605	Bokep Sucking Big Me culiaron en una residencia del centro de Bog…
606	Bokep Indo Stevie Lix busty blonde matue lady suck and fuc…
607	Bokep Online Ghetto Latina Azucena Love FAT MEXICAN BBW PORN…
608	Bokep Online Cumslut can’t get enough
609	Download Bokep Best fuck in scooter on street-Watch part 2 on …
610	Bokep Sucking Big Testicle destroyer Ballbusting
611	Download Bokep Kendra Lynn bring her fuck buddy
612	Bokep Japanese Big tits sex doll – sex dolls – new sex toys
613	Bokep Sex Sexy kitty posing with dildo
614	Download Bokep SELL YOUR SOUL featuring (Niki Sweet, Lovenia L…
615	Bokep Sex La Pepina Chilena masturbating with ice cream p…
616	Bokep Porno Slave girls dominated in public by master – Hentai
617	Nonton Video Bokep Streaming Anita Cummings has a roommate help her squirt f…
618	Bokep Indo Big boobs Euro nurse Kathy Sweet spreading twat
619	Download Video Bokep Closeup butt hole and pussy clip
620	Download Video Bokep Sex Adventures Pt2
621	Bokep 3gp anal a mi cristiana culona insaciable
622	Bokep Porno The Great Sale on JenySmith.net
623	Bokep hot black couple
624	Bokep Indo Puma Swede Fucks Hitachi on Set!
625	Bokep Streaming Untitled 1280×720 3.78Mbps 2017-10-21 06-05-52
626	Bokep Lesbian adventures on wooden raft # Brea Daniel…
627	Gratis Bokep He Came Twice!Would You?
628	Nonton Video Bokep Stormy Weather for Nasty Royalty!
629	Bokep Porno MILF and teen dominated and roughfucked
630	Gratis Bokep Teen Lesbians Addison Ryder and Karlee Grey POV
631	Download Video Bokep My Secret Life, Vol.1 Chapter 1 Act 3
632	Download Bokep Streaming GIRLSRIMMING – Darcia Lee Family Rimjob
633	Bokep Online Cutie shakes it on her FREE camera at TryLiveCa…
634	Bokep Japanese Kinky dad fucks his curvy daughter while she wa…
635	Nonton Video Bokep Streaming Outdoor-Latina get a fuck,cum,and lolipop to ol…
636	Bokep Girl having a nice conversation with Dick Flash…
637	Download Video Bokep Fuck Me for the Audience
638	Bokep Porno your big black cock fucking me really good
639	Gratis Bokep Mya Lane Gives Blowjob in the Forrest
640	Bokep Sucking Big Dark and hot. Fuck till you come and I won’t mi…
641	Bokep Indo Mofos – Project RV – Petite Teens RV Fuck starr…
642	Download Bokep Alexsis faye masturbating in the bedroom
643	Bokep Korean T&A 178 – RimJobs
644	Bokep Indo Hooker threeway with babes cocksucking
645	Nonton Video Bokep BLACK4K. Fucking with a beauty queen
646	Nonton Video Bokep Slut Wife Takes Huge Facial While Husband Watches
647	Download Bokep Anal and all spem in assholle
648	Bokep Jepang HITZEFREI Big tit redhead fucked by stranger
649	Bokep Indo Scarlett Synn goes back a for more random cock …
650	Bokep Korean double dose
651	Bokep Indo Tamed Teens – Nelepa (Monday) PMV (CTV)
652	Bokep Sucking Big Taking Whats Hers with Goddess Jane
653	Bokep Porno Club Pick Up 3 Trailer
654	Bokep Porno Anastasia Lux hot fuck
655	Bokep Busty Chicks Cathy Heaven & Kayla Green Get Fuc…
656	Gudang Video Bokep Streaming Wet T-Shirt Babe With Perfect Tits
657	Bokep Indo Interracial Facials 2
658	Video Bokep Scottish cam girl Amateur Doggystyle
659	Download Bokep Streaming cuarta Recopilacion 7 escenas 2016 a 2017 sexo …
660	Bokep Sex Cute Tits MILF Cock Massage
661	Gratis Bokep Streaming Chat with Bonnie And Clyde91 in a Live Adult Vi…
662	Video Bokep Hot oren khan
663	Gudang Video Bokep Nerdy Webcam Slut Covers Hir Tits In Her Own Sq…
664	Gudang Video Bokep Streaming Alexis Fawx Has Been Having an Affair and Fucki…
665	Bokep Streaming 20161010 183029
666	Bokep Online Bubble butt Brazilian babe in a thong bikini in…
667	Bokep 3gp Sofia Cucci “Fuck Scene Investigation” (origina…
668	Download Bokep Dancing and teasing with a yellow zebra panties
669	Download Video Bokep KLIZ
670	Bokep Online Hottest CIM 02
671	Bokep Porno Stmomping on my spittles with Converse
672	Bokep 3gp MELODY
673	Bokep Online Super heros fuck to see who is the horniest ave…
674	Bokep Porno camslut shows all – slutcams69.com
675	Bokep Korean Muesta mis tetas mientras estoy dormida
676	Gudang Video Bokep Streaming Man cums in mouth of sex appeal honey after hot…
677	Bokep Japanese Hot tattooed milf gets wet pussy licked and fuc…
678	Bokep Sex Cute Gal Bonnie Gets Cock For Shoplifting
679	Bokep Sex Slim amateur brunette masturbates with toys
680	Bokep Streaming Two beautiful teens like to share a dick
681	Bokep Porno 20171106 182612
682	Bokep Sucking Big Suspect in custody is obliged into fucking poli…
683	Bokep 3gp Super Tiny Teen Pussy
684	Nonton Video Bokep Streaming 3 of the best struggling submissed babes tied a…
685	Bokep Porno 20180209 221435
686	Bokep Jepang Erotic hypnosis for women
687	Video Bokep gai gia choi gai
688	Gudang Video Bokep Castings and sex parties with real amateur girls
689	Bokep Sex Real. Fucking my aunt. Hidden cam
690	Bokep Porno Granny and teen lick each other’s buttholes
691	Bokep Streaming MF004239 1 01
692	Bokep Sex Darla Crane sucks Mandingo’s dick (Swallows cum)
693	Gudang Video Bokep Streaming dana reto
694	Bokep Streaming PANTIESCRIS
695	Gratis Bokep Sultry-Hands-On-The-Work
696	Download Bokep Streaming LapDance
697	Bokep Indo Who is she? Name please
698	Bokep Sucking Big POV with a cougar
699	Download Bokep She loves these dildos
700	Bokep VID-20170801-WA0059
701	Bokep Porno BITCHES ABROAD – Russian tourist Selvaggia gets…
702	Bokep 3gp Carmen Luvana casting
703	Gudang Video Bokep Streaming 1
704	Bokep Korean Housewife masturbate for you
705	Download Bokep Mona Belt Whip
706	Nonton Video Bokep Streaming Ultimate Yoga Sex
707	Video Bokep Japanese Gracie lesbian
708	Bokep 3gp Raw casting desperate amateurs compilation hot …
709	Bokep 3gp anabellaxxx1-orgasm-closeup
710	Bokep Indo Girsrimming – Gina Gerson Prostate Massage
711	Download Video Bokep MyFavorite girl since a long time… the best…
712	Nonton Video Bokep Tight teen Elsa toys her wet pussy
713	Bokep 3gp Hotel sex Young teen orgasms and Facial cumshot
714	Bokep Online GOFUCKAGIRL – Brother Vira Gold teaches step si…
715	Bokep Gloryhole with BBC
716	Video Bokep Japanese British schoolgirl bukkake drenched in group
717	Download Bokep Wet Pussy Solo Squirting Cosplay With Toys
718	Bokep Jepang Cam Model Katie71 April 2018 Trailer for her ka…
719	Bokep 3gp Natalia Starr Scissor Fucks Aaliyah Love In Lin…
720	Gratis Bokep Streaming chat real, cam.555.hhos.ru
721	Gudang Video Bokep Streaming Free legal age teenager upload porn
722	Bokep Porno xxanita danish amateur
723	Bokep Korean Young Big Booty Teen Shows Off Her Feet
724	Gudang Video Bokep Amateur Rough Facefuck And Ass to Mouth – Young…
725	Nonton Video Bokep Streaming Horny Girl Needs Fucking
726	Bokep Josh and jenny fun 9
727	Nonton Video Bokep Playing Anally With A Pretty Girl!
728	Bokep Korean Lbdee creampie aftermath
729	Nonton Video Bokep Blonde Teen Begs for Huge Creampie In Her Pussy
730	Gratis Bokep Cheating Wife Fucks Construction Worker
731	Bokep Indo Virgin casting with cute Melinda
732	Video Bokep Hot girl annoys her man on periscope
733	Bokep Sex She plays with a dildo while exercising on cam
734	Bokep Korean Ana Polina swallowing cum after deep anal sex! …
735	Video Bokep Me and bae sex chronicles
736	Bokep Indo Lexidona – Stripdance – Home Made
737	Gratis Bokep Raven Swallowz Ebony Bikini Model Loves Cream
738	Gratis Bokep Fucking my Boyfriends Best Friend
739	Gudang Video Bokep Free Solo Masturbation Compilation
740	Bokep Porno Impressive bedroom Japanese xxx with lustful Ic…
741	Bokep Streaming Camfrog queenie
742	Bokep Streaming Cute Girl bad
743	Video Bokep Japanese Older white guy fucks young ebony SLUT
744	Bokep Porno video159674
745	Gratis Bokep Girl sexy ass girlcam24.com
746	Bokep Japanese Brunette Sexy BabeHardcore free live cams
747	Bokep Jepang 20171011 234102
748	Bokep Streaming Amateur hot wife creampied
749	Bokep BLACKEDRAW Black stud takes Angela White in her…
750	Bokep Korean 41Ticket – Riku Shiina’s Final AV Scene (Uncens…
751	Gratis Bokep Streaming Leah Jaye and Sahara Knite Scene 2
752	Bokep Streaming Depilation sex Katerina Hartlova
753	Bokep Indo Lactation02
754	Bokep Online NEW Naughty America VR: Big tits and big butts …
755	Gratis Bokep old and young hot couple – mom on not her son…..
756	Bokep Indo Cum all over my Big Tits
757	Bokep Online Broke big tit teen in glasses fucked outdoors
758	Bokep 3gp ProducersFun – Hot Blonde Teen Sierra Nicole da…
759	Bokep Porno Busty teen Alexis Adams loves big and long cock
760	Bokep Korean TASTE OF MY FIRST CUCKOLD HOME VIDEO ( 6 YEARS …
761	Download Video Bokep Jelena Jensen Fucks Big Blue Toy!
762	Bokep Porno Cumming Inside Her!
763	Bokep Sex Deep throat
764	Bokep Korean one day with a real swinger amateur MILF on liv…
765	Download Video Bokep vídeo101
766	Video Bokep Korean Roop Tera Mastana XXX – Longer Version 2
767	Gratis Bokep Samantha Bentley Bends Over for Her Casting
768	Gratis Bokep Streaming BANGBROS – Marvel At Blondie Fesser’s Glorious …
769	Video Bokep Korean Black haired bambi knows how to jerk off severa…
770	Bokep Korean Curvaceous ladies enjoying foursome sex in the …
771	Gudang Video Bokep Streaming Quick cheap blowjob from street whore
772	Gudang Video Bokep Streaming TRUE ANAL Adriana and Megan anal and squirt fun!
773	Bokep Online Waxing Mr Ugly Teaser
774	Bokep Sucking Big Heavily-breasted Elay Smith rides a dildo till …
775	Bokep Korean 20180113 132545
776	Bokep Sucking Big Sexy Girl Piercing Emmo Girl
777	Bokep Indo Blonde sister and her beautiful vagina!
778	Download Video Bokep Avy Scott gets her pussy fucked hard
779	Bokep Korean Petite teen eating ass
780	Video Bokep Hot Deepthroatdisturbia 1
781	Video Bokep Sex Teens Kimber Lee & Ashlynn Worship Each Others …
782	Nonton Video Bokep Streaming Latina First Timer fucks on camera, loves it.
783	Bokep Streaming Real poolparty teens interviewed after orgy
784	Bokep Streaming Spelling-Test, she has a special art to remembe…
785	Bokep Porno Young teen getting drilled in wet pussy by hard…
786	Gratis Bokep I could be your personal whore! – Jeanie Marie …
787	Bokep Streaming Tight ass Thai bitch plowed from the back with …
788	Bokep Porno goin down
789	Bokep Jepang – 3D PORN GAME
790	Nonton Video Bokep Streaming Pinkyxxx Black Booty cartoon backalleytoonzonli…
791	Bokep Streaming Hot Fuck and Facial-Get CAMS of girls like this…
792	Bokep Porno Guy Invites His Sexy Little Cousin to Meet His …
793	Bokep Streaming CherrySoda in: My Playtime
794	Bokep 3gp Sensual Suite: Daya Knight
795	Gudang Video Bokep Granny fucked hard in her ass by black guy she …
796	Bokep Sex Teen POV handjob
797	Bokep Japanese amateur couple sex teen fucked doggystyle watch…
798	Bokep Japanese live como camgirl em 2016
799	Gratis Bokep Streaming Fetish-Lack & Leather, mask, cum on facefuck
800	Gudang Video Bokep Sofia Cucci backstage of an interracial porn sc…
801	Bokep Online Blasting the motherload on a german girls face …
802	Bokep Online Wife anal creampie on real homemade
803	Video Bokep Online Nicole Aniston fucks Sheena Ryder
804	Download Bokep Anisyia in black stockings plays with her wet cunt
805	Bokep 3D Blonde Sex Slave
806	Nonton Video Bokep Streaming what ccan i do to make you love me
807	Download Video Bokep Super hot blonde on web cam
808	Video Bokep Korean Indian Housewife Madhuri Home Alone Masturbation
809	Bokep Streaming girl sexydea squirting on live webcam
810	Bokep Online Dildo Riding
811	Gudang Video Bokep Analsexnow suck Anal Cum excelent
812	Nonton Video Bokep Streaming Tupornmex Shower Trailer
813	Bokep Porno Vikci 6
814	Video Bokep Sex alena romanian goddess perfect body
815	Bokep Streaming JS.05 Jay Savage & Miss Raquel Fuck BussShotPro…
816	Video Bokep Wife Eva Sumisa. Piss
817	Bokep Her first time fisting and she loves it
818	Bokep Japanese Experience Brooke Brand at Naughty-America VR
819	Bokep Porno Sativa Verte, Mystery Shopper
820	Download Bokep Streaming Wife Sucking Juicy Black Cock!
821	Bokep Jepang The Best Lesbian Kisses
822	Bokep Jepang Sexy teen cutie
823	Bokep Sucking Big French extreme An Overdue Anal Payment
824	Nonton Video Bokep Streaming Mia Linz – “Plug Anal”
825	Bokep De perrito con rubia hermosa
826	Bokep Lindsey Sheron interracial cuckold
827	Bokep 80085
828	Bokep Porno 50 Shades of Rockard – Anal hook
829	Bokep Indo Daddys little girl got a big dildo in asshole C…
830	Download Bokep Foot fetish porn with Monique Woods and Csoky Ice
831	Gudang Video Bokep Streaming me masturbating
832	Bokep Porno Geeky sweetheart is bounded for violent torment
833	Bokep Indo Free Membership at : http://BIGINDEXVIDEOS.COM …
834	Video Bokep Marlen doll Fucks a Fanboy
835	Bokep MAXXX LOADZ AMATUER HARDCORE VIDEOS FIRST TIMER…
836	Bokep 3gp Nasty anal threesome with Tina Kay and Lilu Moon
837	Bokep Sucking Big Amateur Brunette Dressed Like A Naughty Schoolg…
838	Bokep Streaming Beautiful young asian chubby teen bitch pussy w…
839	Bokep Korean Walk ino the pool to move panties on side and t…
840	Bokep Streaming My vid Touch me
841	Bokep Sex trim.4C072883-AA73-4E51-B563-B7AE69DEFED1.MOV
842	Download Bokep Streaming Who knows their names? Or movie name? Pls!
843	Bokep Porno QUICK FIX featuring (Zazie Skymm, Kai Taylor)
844	Video Bokep Online Reallifecam Voyeur Lesbian orgasm amateur xxx
845	Download Bokep Dakota Skye Anal sex
846	Bokep Porno Indian Wife In sexy Chemise Baby Doll
847	Bokep Sex *TESTING* SHOWING OFF ON THE BED
848	Gratis Bokep Shital406
849	Bokep 3gp Slut ria sunn riding and sucking big fat dicks
850	Download Bokep Streaming MVI 5469[1]
851	Bokep Sucking Big Chocking on his Cock
852	Nonton Video Bokep Streaming EBONY MATURE MILF LOVES 2 SUCK FUCKIN UNTIL SHE…
853	Bokep Streaming Girl With Scorpio Tattoo
854	Bokep Black Hood Bitch That Work At Strip Club From -…
855	Video Bokep Korean Candy LickHer & Then StickHer
856	Bokep Online 0819438636 desi paar fucking in hotel scandal v…
857	Download Video Bokep White girl sucks black dong in advance of feeli…
858	Bokep Japanese PAWG Red Sensation Round Booty
859	Bokep Sucking Big Young Shaved Pussy Toyed On Webcam With Vibrator
860	Video Bokep Korean Horny Thief Tales – Ira entertains her horny
861	Bokep Sucking Big Dirty Footsies At FetCon With Chrissy Daniels
862	Bokep Indo Katerina Kay Gives Lip Service
863	Bokep Porno Teen webcam hd and playfellow’s partner’s siste…
864	Gudang Video Bokep Female Fake Taxi Sexy minx driver sucks and fuc…
865	Gratis Bokep Streaming RealityKings – We Live Together – (Chanel Prest…
866	Bokep Indo 18auditions.com – Comp #218yo Asian & White G…
867	Gratis Bokep Amazing perfect blonde cop brutal ass fucking a…
868	Video Bokep Hot Beauties arrange a breathtaking casting session…
869	Bokep Streaming Annabelle Flowers – Fantasy Anal Part 3
870	Download Video Bokep Big tit country MILF rides cock BTS
871	Bokep Sex Black big secretary enjoys with her chief #1
872	Download Video Bokep Gold Statues come to life and eat each other out!
873	Bokep POSSESSED
874	Bokep Japanese www.teeniecam.xyz | Omegle Adventures: Hairy Fr…
875	Bokep Porno Deborah outdoor casting
876	Bokep Porno Our amateur best squirt orgasm compilation. Max…
877	Bokep Streaming What is her name?? Any other videos?
878	Nonton Video Bokep Streaming three x’s the fun
879	Bokep Hotel Thot Tryna Take Dick
880	Bokep Porno ornstar Marica shows off her new silver vibrator
881	Download Video Bokep Sweetie Bounces on a Big Ball
882	Bokep Porno 8 HORNY BI Milf WIVES on a BOAT
883	Bokep Jepang WELCOME TO THE MOST LIT CHANNEL ON XVIDEOS – LI…
884	Bokep Japanese My wife is never going to fuck other big black …
885	Video Bokep Korean Sperma douche terwijl ik slaap
886	Bokep Ebony Nadia Jay Busty slut ball licking
887	Bokep 3gp Female pee desperation and wetting themselves J…
888	Bokep Porno Lbdee Amateur deepthroat blowjob part 1
889	Bokep Porno 20161105 121058
890	Bokep Porno MISTRESS MIRA – BONDAGE ANAL CUCKOLDING AND RUI…
891	Bokep Japanese This is the best anal ever
892	Bokep Indo Homemade sex
893	Bokep Porno Blonde babe fuck and suck. More at PETITX.com
894	Bokep Korean http://JMPORN5.INFO –– Erotic Indian Explorat…
895	Bokep Indo Busty Jonee strips showing her hairy pussy
896	Bokep Streaming Unforgatable immoral action featuring a bubbly …
897	Bokep 3gp Cocksucker in bath
898	Download Bokep My wife is the best
899	Bokep Online Sex Craved Carmen Valentina Is Pounded By A Big…
900	Bokep Jepang Horny milf sucks cock and takes cumshot to the …
901	Bokep Streaming Girls Just want to have fun
902	Bokep Korean Royal Anal – School Girl Prefers Anal –
903	Video Bokep Hot Slowheadreddxxx Snap compilation
904	Bokep Thin with hanging tits 54 years in the chat, th…
905	Video Bokep Intimate amateur couple fucking for 30 min
906	Gudang Video Bokep Streaming Asian Couple Hard Banging In The Woods!
907	Gratis Bokep Streaming Luca Borromeo, Mary Rider, Luna Dark in Spicyla…
908	Gudang Video Bokep Slutty Whore Squirts
909	Bokep Porno Cam chat 1
910	Gratis Bokep Streaming Busty Buffy gives her big puppies an oil massage
911	Gudang Video Bokep Streaming Teens get mouth creampie from grandpa after the…
912	Gratis Bokep Streaming Mea Melone get double anal trial with two amateurs
913	Bokep Streaming Liz Vicious Cam Show Fun
914	Download Bokep Streaming Owning her pussy and mouth, teen babe from www….
915	Bokep Indo Sex in public pool porn
916	Bokep Online Farting Shots in My Leisure Time
917	Bokep Japanese Jessica – Hot Amateur Brunette On Creamy Mastur…
